id,title,text,cleaned_text,author,subreddit,score,upvote_ratio,num_comments,created_utc,url,is_self,word_count,char_count,cluster_id
1nm7tf5,"How is insurances ability to decide what physicians orders it will, or will not, cover not unlawfully practicing medicine?",,"insurances ability decide physicians orders , , cover unlawfully practicing medicine ? appealing surgery 4 years , literature denial papers says thing every time pay x , x treatment condition , diagnosed condition opinion need treatment x",Wilson_serenity10,healthinsurance,15,0.64,24,2025-09-20 15:52:39,https://www.reddit.com/r/HealthInsurance/comments/1nm7tf5/how_is_insurances_ability_to_decide_what/,0,37,238,136
1n7pzwe,Single Mother Medicaid Question in Mississippi,,"single mother medicaid question mississippi friend recently moved ms child wanted transfer benefits food stamps medicaid . first ms medicaid office told need benefits cancelled prior state , made sense . applied rejected appealed . today appeal call asked father child , know . told eligible medicaid ms would need pursue child support father . father birthday certificate , unsure father never pursued child support partners moved . apparently child , inedible want someone pursue child support . trying get insight imagine person ms get child support father birth certificate quite make sense head supposed .",mrgud69,Medicaid,16,0.84,30,2025-09-03 16:28:18,https://www.reddit.com/r/Medicaid/comments/1n7pzwe/single_mother_medicaid_question_in_mississippi/,0,96,610,-1
1njr4at,My doctor abandoned me and I'm so scared,,"doctor abandoned scared need get . 31f feel alone know else turn . started back april , feels like body betraying . began symptoms : palms would turn ghostly white . half fingernails would go blue , map blue veins would surface hands ; something never seen . hands normally kind red see veins like . heart started racing moment woke , sitting 100 bpm day long reason . get hit random , dizzy spells sitting trying simple things . absolute worst sleeplessness . literally unable sleep 6 days straight . wink . wired awake , felt trapped exhausted body . legs constantly cold swollen . went doctor , scared mind , hoping answers . ekg , blood tests , wore heart monitor . blood tests came back normal , monitor showed blood pressure would sometimes plummet . . gave . advice ? build muscle see therapist stress . refused give medication , quote words : would kill . . cold , dismissive . care . whole experience difficult . felt alone . , months later , still suffering . high heart rate day stopped , moment lay bed night , spikes back 95 100 . go sleep . lie hours heart calms pass pure exhaustion . hands daily reminder . look okay morning , bit , pallor returns , nails go blue , blue veins appear like something really , really wrong . legs still swollen . feel like brain getting enough blood . memory shot . feel weak , defeated , incredibly scared every day . know . know turn . anyone else experienced anything like ? please , idea could kind doctor see next . would grateful help . thank reading .",Rever-autre-chose,AskDocs,98,0.86,34,2025-09-17 18:20:34,https://www.reddit.com/r/AskDocs/comments/1njr4at/my_doctor_abandoned_me_and_im_so_scared/,0,285,1505,-1
1n7z3cm,My partner has a psychotic break yesterday. What happens now?,,"partner psychotic break yesterday . happens ? 40m came home work yesterday walked kitchen started calmly telling 41f accidentally broke timeline working multi verses try fix six year old helping pure soul needed kinds wild stuff . told delusional needed stop . really calm said understood would say get explains etc etc . immediately got best friend husband . spent long time talking husband back went upstairs got ahold sister loves hours away . turns happened , five years ago . going pretty awful divorce , kids six , pandemic , whole town burned . got suddenly delusional , mom sister came took several days talk getting meds helped quickly went back normal . since nothing like ever happened , thought isolated incident , nervous breakdown stress . stress . known three years recently moved together two kids two kids . things wonderful fine . know diagnosed bipolar discussed early relationship . asked looked like episode said gotten depressed past . ok dealing c ptsd , one judge . mad whole story , told really happened . everything wonderful . life fine . kicked . friend husband able get er last night apparently calmly explained staff said seem dangerous keep . agreeable friendly evening . unnerving . near kids especially involving littler one delusions . mom flew today hotel , trying convince go get abilify shot apparently worked last time . know going succeed long take . look like comes , ? understand happened ? need able talk make plans . functional ? depressed ? lose job ? never seen anything like . would really like hear experiences . scared sad .",DearUnderstanding746,MentalHealth,207,0.87,170,2025-09-03 23:05:10,https://www.reddit.com/r/mentalhealth/comments/1n7z3cm/my_partner_has_a_psychotic_break_yesterday_what/,0,272,1572,144
1nl6e9b,My wife’s insurance is saying my baby was not added in time. What options do we have?,,"wife insurance saying baby added time . options ? child may . husband added baby insurance plan within first month . hospital billed wife insurance saying since never formally added baby plan , covered . realize formally add , never first child either . assumed covered insurance birth affordable care act , like daughter . options ? think filing appeal sure go .",Ready-Step7668,healthinsurance,10,0.68,43,2025-09-19 11:18:35,https://www.reddit.com/r/HealthInsurance/comments/1nl6e9b/my_wifes_insurance_is_saying_my_baby_was_not/,0,63,363,129
1n1sbhe,Price for visit went up when I disclosed I have high-deductible health insurance...,,"price visit went disclosed high deductible health insurance . upcoming medical appt received estimate visit hospital 247 included self pay discount automatically added . lot money worth issue dealing . high deductible 18k health insurance added account see negotiated rate would better . new estimate 375 negotiated rate . switched back self pay removed discount took price 480. talked someone said self pay discount folks without insurance . feels really unfair pay 6000 premiums per year pay higher rate health care . dying , recourse options get better price ? thanks ideas .",IamUsingaComputer,healthinsurance,32,0.76,57,2025-08-27 16:33:31,https://www.reddit.com/r/HealthInsurance/comments/1n1sbhe/price_for_visit_went_up_when_i_disclosed_i_have/,0,93,578,-1
1myr73a,"toddler has 40 minute unconscious, unresponsive episode - discharged without answers.",,"toddler 40 minute unconscious , unresponsive episode discharged without answers . son 2m , 90cm , 13.5kg , mixed race , otherwise healthy . takes medication . flu month ago recovered . normal day , ate lots , played playground , dug garden . looking someone diagnose , help understand responses medical professionals changed night morning , advice go terms follow . really struggling understand happened means us moving forward . became drowsy 10 minutes playing bath . swaying back forth , drooping eyelids , eyes rolling back head . reminded someone overdosed . got bath straight away thought would hit head . unusually drowsy normally 6:15pm would running around acting crazy , sleep 7:15 , answer questions touch nose asked . rapidly lost consciousness . called ambulance rouse kind touch , sound light . arrived quickly monitored vital signs , said good , concerned lack response pricked heel blood sugar test , pinched , react . breathing slow within normal range . eyes closed respond light held eyelids open . first thought poisoning , got kind medicine cleaning product , docs reckon recovered quickly enough rule . tox screen . total time remained unresponsive 40 minutes . floppy , pale , totally unresponsive pain stimuli . came , dazed confused hour , trouble speaking bit wobbly walk . returned baseline 2 hours . first brought , paramedics nurses saying suspected seizure , seemed fit symptoms . kept telling really serious 40 minutes long time completely unconscious unresponsive . wanted move paediatric ward beds available . also initially planned extra heart test happen . also going follow neurology clinic . night long monitored vitals , took bloods stuff , reiterated plan next day admission tests due length episode . next morning new doctors suggested fainting episode caused low blood pressure , maybe dehydrated , maybe bath hot , etc . , sure , bp low one point episode , normal . also question would happen 10 minutes bath , rather straight away , heat issue . could dehydrated done wees day drank cup water bath ? asked would explain length time unconscious said , well , . asked , , would cause ? said , unknown , unexplainable ! dazed afterwards unexplainable ! officially called period altered consciousness without clear cause . like want seizure , heat bp drop dehydration seem explain length time unconscious impressed serious . almost felt like believe something , even though paramedics noted details . change acted night vs morning really jarring . maybe full overrun needed us make space . also , get , least follow plan would nice ? left without follow plan really confused worried could happen worse next time . sorry picture scariest moment life still feeling shaken without answers . would appreciate someone could walk also decided fine .",songoftheshadow,AskDocs,98,0.97,28,2025-08-24 05:33:51,https://www.reddit.com/r/AskDocs/comments/1myr73a/toddler_has_40_minute_unconscious_unresponsive/,0,469,2782,-1
1ndy672,My daughter’s 10 day decline,,"daughter 10 day decline summary daughter past ten days . doctors stumped . ideas suggestions greatly appreciated . summary past 10 days 14 year old girl baseline previously healthy , major medical psychiatric history reported , drug use , family history mental illness , successful socially academically . initial symptoms day 1 3 sudden onset waking 2 3 hours sleep . unable return sleep . episodes anxiety panic attacks , early catatonic symptoms freezing , inability respond first appeared . developed derealization feeling detached unreal . noticed ear discomfort pain still present episodes . progression day 4 7 symptoms escalated daily episodes . typical episodes include : confusion disorientation , emotional distress panic , strange altered experience time , abrupt repetitive movements , transient left sided numbness tingling , ear discomfort . episodes often triggered screens , loud noises , bright lights shining eyes . total loss appetite desire drink water acute crisis day 8 9 experienced massive panic attack . within hours , complete psychotic break : recognize parents believed trying kill paranoid delusions occurred break . marked behavioral change , largely resolved back usual episode pattern . medical workup ct scan : normal mri brain : normal lumbar puncture spinal fluid : normal eeg : abnormal , showing slowing right side brain suggests focal cerebral dysfunction . medication reactions adverse reactions : ativan lorazepam , gravol dimenhydrinate , trazodone , lorazepam significant adverse response noted . current status day 10 continues severe psychiatric neurological symptoms . catatonia escalated : began panic related freezing today progressed 3 minute episode total catatonia . ongoing symptoms include confusion , panic , altered time perception , abrupt movement episodes . psychosis limited one break paranoid delusions event . neurological features : eeg abnormality , left sided numbness tingling episodes , ear discomfort . environmental triggers : screens , loud noises , bright lights . medication sensitivity complicates management . key features abrupt onset within days . predominantly neurological catatonic episodes psychiatric overlay . single psychotic break paranoid delusions ongoing . abnormal eeg right sided slowing despite normal ct , mri , spinal fluid . escalating catatonia medication intolerance . urgent need neurology , psychiatry , immunology collaboration . : today got blood serum results back confirmed anti nmda receptor encephalitis . result made feel simultaneous relief rage . relief began treating form autoimmune encephalitis 5 days ago iv steroids ivig , began show signs improvement almost immediately . rage first neurologist thought psych patient delayed testing 4 days . mri csf clear refused treat pushed hard enough change mind . longer shows signs panic , agitation , catatonia . still gets confused sad , feel like daughter back exhausted version . appetite coming back last night slept 8 hours straight . clearly months fully recovered overall direction upward . slowly tapering ativan , clonidine , trazedone , tomorrow infusion rituximab followed second infusion two weeks . hope go home 2 days . experience torture glad put rear view mirror . express grateful everyone took time read situation offer suggestion , story , support . seriously , thank .",Chachichachichicken,AskDocs,415,0.99,169,2025-09-10 23:13:59,https://www.reddit.com/r/AskDocs/comments/1ndy672/my_daughters_10_day_decline/,0,516,3340,-1
1n4hmhw,I'd appreciate some advice,,"appreciate advice hello , stay home mom . family lost health benefits two months ago husband lost job due chronic illness . thankfully , able get onto obamacare soon , paying 0 month family four . however , recently notified cvs pulling state next year , whatever new insurance get onto give us good price . upcoming changes 2026 , begun applying full time jobs would come health benefits , hoping get one soon husband know able return work unfortunately . breaks heart think suddenly away kids , sometimes difficult things . anyway , also weighed another option , freelance work home . took online course taught skill , potential make good money get good get clients . course , purchase health insurance . question would recommend safest option ? fear 2026 comes expiring subsidies , ton people self employed suddenly going flooding workforce , desperate get jobs offer health insurance . want competing . monthly take home husband long term disability insurance 4100 gross . number , anybody know around much monthly premium would jump 2026 , , let say , started bringing home 3k month , total monthly household income would around 7k ? tried calculators online , feel like getting lot conflicting information . advice ? tend financially conservative ; like feel safe back plan back plan : thank !",Chocolatier23,Obamacare,7,0.89,8,2025-08-30 21:01:12,https://www.reddit.com/r/obamacare/comments/1n4hmhw/id_appreciate_some_advice/,0,223,1299,-1
1na7wct,Doctor changed location then charged me anyways,,"doctor changed location charged anyways question handle . doctor office called left voicemail surgery moved different location . notice voicemail went original location time . showed , explained doctor longer . called office said waiting . new location 30 min away would 10 min late said coulnd see anymore doctor would like talk minutes . accepted spoke doctor 10 min , completely useless basically apologized asked reschedule . big surprise , office billed 1,400 usd 10 min call insurance refuses pay since approved appointment sth like . already rejected bill threaten send collections . ?",selfdrivingfool,healthinsurance,11,0.87,18,2025-09-06 15:06:20,https://www.reddit.com/r/HealthInsurance/comments/1na7wct/doctor_changed_location_then_charged_me_anyways/,0,95,592,-1
1n56o3a,GATEKEEPING Doctor Husband Won’t Answer My Question and I’m now asking the internets.,,"gatekeeping doctor husband answer question asking internets . really hoping gastroenterologist sees answer : question living rent free head far long gatekeeping emergency physician husband laughs whenever bring refuses answer . career , related number cases treated septic patient due nick bowels insert number abdominal surgeries . super scary , super dangerous , apparently far common anyone comfortable . poop gets blood . patient goes sepsis . simple cause effect . butttt pun intended , asked ever seen treated sepsis resulting bleeding ruptured hemorrhoids internal external , looked like crazy , laughed , said t. pressed information : happen ? open wound , poop , sepsis , right ? need know one happens nature unreasonably curious person . brought several times always laughs tells look . dr. google internets send rabbit holes never answer question . vasculature different colon ? like antibiotic slime layer ? know poop still bacteria millions people piles going septic left right ? ! could see argument solid poop might well solid get cut . explosive diarrhea ? please help : tried post think ai thought rhetorical question denied .",You-bettah-dont,medical,99,0.9,36,2025-08-31 17:29:22,https://www.reddit.com/r/medical/comments/1n56o3a/gatekeeping_doctor_husband_wont_answer_my/,0,184,1143,-1
1na0m7e,United Healthcare is turned down my surgeon's request to do Botox injections for a desperately needed hernia repair!,,"united healthcare turned surgeon request botox injections desperately needed hernia repair ! know chose right flair . apologize . bind desperate need advice . morning optum rx , behalf aarp united healthcare , called say turned surgeon request botox injections abdomen . treatment greatly reduce chances recurrence . third hernia . complication cancer surgery 20 years ago . forced live hernia many years money health coverage . , feels like told allowed use . judging conversation surgeon days ago , surgery b happening within couple months . know even get . want scream stop crying . insurance company cruel beyond . please tell done fix . devastated . thank .",JadedCitizen2022,healthinsurance,12,0.71,40,2025-09-06 10:14:28,https://www.reddit.com/r/HealthInsurance/comments/1na0m7e/united_healthcare_is_turned_down_my_surgeons/,0,110,662,68
1nbb51t,Denial situation,,"denial situation hey . health event . think 911 , straight ct , straight ro mri , overnight hospital . discharged . , continued symptoms events discharge . doctor told go back er admitted . insurance company denying second hospital stay , saying medically necessary . everyone network . know lot information , potentially looking terms process risk ?",Reisefieber2022,healthinsurance,11,1.0,17,2025-09-07 21:46:55,https://www.reddit.com/r/HealthInsurance/comments/1nbb51t/denial_situation/,0,59,350,-1
1njfj8r,Tips for making the most out of my insurance if my pregnancy spans two separate insurance periods?,,"tips making insurance pregnancy spans two separate insurance periods ? first , gave birth november , met pocket pretty easily lot covered . due mid may , stressing coverage . heard certain oon places global bill related services actual birth , sure misinformation applies oon services . way ? suggestions optimize insurance ? receive insurance husband employer . decline coverage employer , option . feel like understand little insurance , got things missing ! heard little , non pregnancy related hacks health insurance , calling hospital offering pay full right away give discount sure misinformation ask itemized bill helped catch many mistakes past . else ? ny , usa reference 31 year old 78000 estimated gross income",Otherwise-Big-2037,healthinsurance,8,0.9,32,2025-09-17 11:00:52,https://www.reddit.com/r/HealthInsurance/comments/1njfj8r/tips_for_making_the_most_out_of_my_insurance_if/,0,117,721,-1
1nlt1ze,Feeling completely neglected postpartum while my husband spends his paternity leave at his mom’s hospital,,"feeling completely neglected postpartum husband spends paternity leave mom hospital gave birth baby girl september 6. husband birth , felt amazing . next day , go back work , understood , since job demanding . supposed get 10 days paternity leave days later , really looking forward side . mother , recently knee transplant , fell major injury required another surgery . completely understand situation fully supportive . home dealing postpartum recovery , sleepless nights , pain , newborn , mostly alone . mom helping , grateful , really wanted . whenever try tell feel , ends fighting phone . ask , talks baby mother . bring feelings , tells , girls go , normal . literally paternity leave , sitting hospital , feel completely invisible uncared . feel lost , exhausted , unloved , deeply hurt . spent whole pregnancy alone , postpartum feels lonely . scared paternity leave go hospital duty , go straight back work . never stayed together 3 months time since marriage , isolation really hitting hard . know make understand need without causing fights . want someone care emotionally recover . anyone else felt way postpartum ? cope partner emotionally present ?",Wild-Wing-1211,MentalHealth,63,0.91,64,2025-09-20 04:47:30,https://www.reddit.com/r/mentalhealth/comments/1nlt1ze/feeling_completely_neglected_postpartum_while_my/,0,198,1164,88
1nbf7ad,Ohio - Recent College Grad with New Job,,"ohio recent college grad new job hello everyone , recent college graduate ohio . family medicaid long time recently got job concerned affect family insurance . moved longer dependent , salary impact eligibility , correct ? move , would lose medicaid coverage well ? really confused long child stay family medicaid coverage wondering anyone knowledge . family immediately report government longer dependent , wait renewal period ? unfamiliar complexities health insurance stuff please forgive ignorance . would greatly appreciate help !",Quirky_Bank1150,Medicaid,3,1.0,3,2025-09-08 01:19:38,https://www.reddit.com/r/Medicaid/comments/1nbf7ad/ohio_recent_college_grad_with_new_job/,0,81,535,-1
1nmd7tn,Missouri Benefits,,"missouri benefits currently medicaid adults missouri kids also medicaid . income level qualify adult , health problems asthma , high bp , heart stuff still figured require covered able live work . job offer health care married . kids dad passed away months ago , start receiving survivors benefitsv social security . benefits 1k month , definitely would put income limit . count income ? , way retain benefits payment ? would advice someone predicament ? work without benefits , seems like kids benefits job qualify . ? want leave job ideal someone health issues obviously need pay rent bills , sure could afford private insurance even extra money meant kids . please help figure .",Scared_Strawberry472,Medicaid,2,1.0,3,2025-09-20 19:47:11,https://www.reddit.com/r/Medicaid/comments/1nmd7tn/missouri_benefits/,0,116,681,-1
1my4u2u,(TW suicide) Could assisted suicide be an option?,,"tw suicide could assisted suicide option ? reposting cause removed . think got right time ? young chronically ill. cfs , fibromyalgia , suspected eds , pots etc . want live right . reasons partner family . far able push , . truth , coping , live like forever , think need know option . know going completely hands live rest life way . want die , happy , fulfilled ready . future version stuck living sick , pain husk human . need know sure looking forward end date may coming . know facilities support , requirements complicated . hope makes sense , appreciate insight may . address couple things keep seeing . aware death permanent ! pain . personally , preference . diagnoses chronic chronic page , meaning going away . miracle cured live completely normal live . peace , . second , suicidal . meaning want die right , going kill . days would absolutely easier alive , happy . simply planning future . third , know things change , fluctuate maybe one day want . like locking dying , able ! get better way . , simply planning possible future , searching information may need able make best decision life . lived life illnesses beyond bearable , want die dignity . want die family , continue living old debilitated miserable woman . also appreciate support info ! true lot us chronically ill people suffer without end date unlike terminal illnesses . forced keep keeping , disheartening .",Aware_Football_8882,ChronicIllness,53,0.83,44,2025-08-23 11:44:39,https://www.reddit.com/r/ChronicIllness/comments/1my4u2u/tw_suicide_could_assisted_suicide_be_an_option/,0,250,1388,-1
