id,title,text,cleaned_text,author,subreddit,score,upvote_ratio,num_comments,created_utc,url,is_self,word_count,char_count,cluster_id
1nau64o,Do you think your chronic illness(es) make it harder to tell when you have other temporary medical issues?,,"think chronic illness es make harder tell temporary medical issues ? hi , several chronic illnesses including hashimoto disease , gerd , dysautonomia , asthma , chronic sinusitis . along journey meet medical concerns notice becomes easier brush things must something one chronic illnesses . example , recently several instances blood urine uti negative brushed maybe dysautonomia salt intake causing urinary strain irritation . 2 weeks later , passed appears kidney stone likely caused several medications increase risk occurrence . seeing brown specks urine experiencing lot pain started questioning hey maybe actually kidneys . anyone else experience feel easier brush issues answer obvious chronic illness es ?",Emotional_Lie_8283,ChronicIllness,128,0.98,46,2025-09-07 10:09:43,https://www.reddit.com/r/ChronicIllness/comments/1nau64o/do_you_think_your_chronic_illnesses_make_it/,0,107,713,-1
1nj2sh7,Plan G,,"plan g research , planning get plan g. reside mercer county . scheduled meetings medicare consultants county medicare officials . assuming afford monthly premium , company choose plan g ensure best service ? eligible medicare december 2025. note : mercer county new jersey thank information . additional question : someone decides say get plan g company . make difference signs directly without help agents . using agent benefits ?",Lotus601216,Medicare,18,1.0,34,2025-09-16 23:47:34,https://www.reddit.com/r/medicare/comments/1nj2sh7/plan_g/,0,69,431,-1
1neoj65,Letter from SSA with form to fill out regarding 'extra help' with prescription drug costs.,,"letter ssa form fill regarding extra help prescription drug costs . first , 60 , social security disability , medicare , medicare supplement probably able afford much longer , zero premium part plan offer . admit shocked saw knew least one bank accounts penny whatever day pulled record . received letter social security administration form fill receiving extra help prescription drug costs , want know pretty much everything . social security disability ssdi , ssi . difference ? difference two handled ? assets matter ssdi ? doubt quality extra help anymore dad passed away , noted . going affect drug costs ? premium part plan right . worrying much extra paying lose extra help . also , worrying going take disability away much . father passed away , money . sucks put retirements account able touch 7 years , know need . anybody else receive letter ? input would appreciated .",Powerful_Entrance_27,Medicare,8,1.0,23,2025-09-11 19:58:47,https://www.reddit.com/r/medicare/comments/1neoj65/letter_from_ssa_with_form_to_fill_out_regarding/,0,151,880,-1
1nljddh,Ga,,"ga live georgia sister 19y syndrome along numerous medical issues . open heart surgery young age every 6 months go heart specialist heart checked , also stay night every 6 months year sleep apnea , speech impediment , iep recently , hearing loss . anyways , always received disability check.i believe , know sure always medicaid . recently , year , medicaid turned reasoning receives disability check . know medicaid based income insurance use ? get job iep speech impediment get insurance work . speech point hard understand grow even hard . words family understand know talking also really bad stutter . therapist would come work 1 2x month ever since little . sorry informative lot information medical finances go , anyone know , medicaid , insurance use ?",PresentSurvey7123,Medicaid,4,0.71,13,2025-09-19 19:54:08,https://www.reddit.com/r/Medicaid/comments/1nljddh/ga/,0,129,759,-1
1nh5va7,Georgia Medicaid/ Georgia gateway question,,"georgia medicaid georgia gateway question hi everyone ! son already medicaid gateway portal trying get . pregnancy medicaid ended , extreme ppd care renew . health issues need get looked , wish would done sooner . trying create application medicaid option select . mean ? certain times apply medicaid ? please help ! tia !",Unhappy_Chef_4143,Medicaid,2,1.0,4,2025-09-14 19:10:57,https://www.reddit.com/r/Medicaid/comments/1nh5va7/georgia_medicaid_georgia_gateway_question/,0,55,322,-1
1myh2n1,So I apparently have to make my post NSFW and TW to ask for help since I'm dying from chronic pancreatitis.,,"apparently make post nsfw tw ask help since dying chronic pancreatitis . said previous post dying chronic pancreatitis plus bunch painful conditions . life sucks sick time going er time . refuse anything . drink , smoke , use drugs , pancreatitis caused birth defect . need pancreas removed one insurance company let go state . tried apply palliative care help people cancer . pain management treat anklosing spondylitis . go er tell go pain doctor . doctors dropped one willing help . supposed live like ? get help dying send home . nobody cares medical community .",[deleted],ChronicIllness,126,0.91,30,2025-08-23 20:00:16,https://www.reddit.com/r/ChronicIllness/comments/1myh2n1/so_i_apparently_have_to_make_my_post_nsfw_and_tw/,0,98,566,-1
1nh5qy5,"Sores in armpit region, any idea on what could be? No insurance, need help",,"sores armpit region , idea could ? insurance , need help hi insurance would like suggestions could thing ask doctor u guys think big enough deal go pay doctor appointment , way maximize appointment needed . happens every couple months , either sores armpits hurt , scan , peels underneath bra rubs hurts also . try shave happens . sometimes get fever cheeks nose flush either , sometimes sores . thank u help ! oh forget 41 year old female .",Next-Bodybuilder-117,medical,16,0.91,44,2025-09-14 19:05:36,https://www.reddit.com/gallery/1nh5qy5,0,81,441,-1
1n80guk,I (18FTM) have a lump of bone on my chest and I neeed to know what it is!!,,"18ftm lump bone chest neeed know ! lump bone 5th 6th rib , right sternum . size shape half golf ball bit bumpy ? noticed grown since little kid . see first picture right side raised , second showing size location tissue . mind small red spots skin , blisters trans tape . ever hurt cause discomfort often forget even still curious actually . worry , got checked small doctors apparently said harmless , mom remember said . trans nothing post , since breast tissue thought would add people confused .",StockLarge5483,medical,6,0.88,4,2025-09-04 00:16:31,https://www.reddit.com/gallery/1n80guk,0,91,499,-1
1n0v82k,I'm going to die alone.,,"going die alone . never really realised lonely . since 16 telling , get group friends start college get friends start university utterly lonely . hate boyfriend , cold horrible friends bullies . contact family friends . sure , secondary school misogynistic boys group chats hangouts without . left behind years ago . fear gotten real , remember mum used tell meet real friends uni . 3 years . feel ill thinking , school almost nobody . like boring , say boring . nobody seems stick though . talk someone class , invite hangout friends bar something never speak next day . float around everywhere . biggest fear younger happening right infront .",Worth-Prompt-4261,MentalHealth,87,0.96,30,2025-08-26 15:23:40,https://www.reddit.com/r/mentalhealth/comments/1n0v82k/im_going_to_die_alone/,0,113,644,104
1mxl1h8,"Do I do Cobra, ACA or something else?",,"cobra , aca something else ? single person , could likely unemployed year . want coverage catastrophic incidents . cobra per month cost 1300 ! literally insane considering 6 month unemployment rate 2k month . honestly know cobra aca . insurance employer cigna oap plan incredible coverage basically everything 100 free . feel like employers least subsidize cobra couple months . mine , cheap shit . ? : thank everyone replies !",Inevitable_Okra_4161,healthinsurance,12,0.72,33,2025-08-22 18:51:48,https://www.reddit.com/r/HealthInsurance/comments/1mxl1h8/do_i_do_cobra_aca_or_something_else/,0,72,427,125
1myyxnk,Part B outpatient hospital coinsurance cap,,"part b outpatient hospital coinsurance cap looking mom claims outpatient hospital heart procedure recently . traditional medicare . surprised see coinsurance amount 1,676. first , thought mistake medicare charging inpatient deductible . thought mistake admitted outpatient observation basis . also , hospital inpatient basis less 60 days , charged inpatient deductible within benefit period . however , little research , learned coinsurance cap expensive outpatient hospital procedures 20 coinsurance exceeds inpatient deductible . case , maximum coinsurance equal inpatient deductible . case , medicare paid hospital 21,000. nice know coinsurance cap hospital outpatient procedures . think applies procedure done ambulatory surgical center , though . anyone else aware cap ? coinsurance caps traditional medicare ?",Distinct-You-7466,Medicare,12,0.94,6,2025-08-24 11:41:52,https://www.reddit.com/r/medicare/comments/1myyxnk/part_b_outpatient_hospital_coinsurance_cap/,0,115,815,-1
1nllyst,NJ family care,,"nj family care anyone suggestions get process 3mo olds insurance quicker ? , older child covered nj family care horizon nj health . newborn covered first 60 days received social security number called register . since july still . call 2 3 times per week still nothing . tell escalate case still time call . even went online filled separate application newborn still nothing . anyone gone advice fasten process ? due 4mo visit vaccinations 2 weeks peds take without insurance . know .",PrestigiousSpeed8090,Medicaid,2,0.75,1,2025-09-19 22:00:34,https://www.reddit.com/r/Medicaid/comments/1nllyst/nj_family_care/,0,84,484,-1
1nd36gc,"I’m 33 weeks pregnant with twins and something feels wrong, I feel vague dread",,"33 weeks pregnant twins something feels wrong , feel vague dread 19f 5 6 130lbs , 33 weeks pregnant twins , working recovering anorexia hi doctors . group really helpful beginning pregnancy , thought would come question . morning started feel nauseous , bad headache . drinking water trying rest eating goldfish crackers , really helping . thrown times , tried ginger tea work started trying sip gatorade . really concerning babies moving differently . know moving concerning movements feel faster ? little frantic ? tell imagining feels like movements almost panicked feeling doom . know hormones .is worth going ? night feeling nervous fall asleep . want seen anxious first time mom , something feels . feel stupid calling saying think moving much . raise red flags ? today feeling overall fine considering 33 weeks twins .",No-Focus-5369,AskDocs,1076,0.97,216,2025-09-09 23:04:19,https://www.reddit.com/r/AskDocs/comments/1nd36gc/im_33_weeks_pregnant_with_twins_and_something/,0,138,825,-1
1n4z8yy,I regret my attempt,,"regret attempt july 13th attempt life c neck . get surgery fix hospitall month . time would sometimes experience nighttime incontinence , pad bed . never thing , believe due severity neck wound , something head body got screwed causing issue . top , neck ugly scar , pretty much always pain . im embarrassed side effect attempt night . worth , fix .",Soft_Transmitter0713,MentalHealth,103,0.97,24,2025-08-31 12:32:33,https://www.reddit.com/r/mentalhealth/comments/1n4z8yy/i_regret_my_attempt/,0,64,349,-1
1ngbrww,"The smarter a person is, the sadder he is",,"smarter person , sadder hi . think lot life . especially hard enter adulthood . face disappointments , pain , loneliness . lose loved ones friends . see system works . rose colored glasses fall . feeling antidepressants help everything . taken , correct wrong . antidepressants improve general mood help feel bad . reasons remain , still live . pain understanding system works . wars go people thought . decisions made without us . politicians play games . pain , betrayal , death . friends leave . parents die get old . need constantly solve problems take responsibility world stop . sadness stronger joy . heavy stone sadness soul changed . think empathetic person , brain , thoughts , harder live human experience . see understand sad feel .",Enough_Classroom809,MentalHealth,81,0.92,33,2025-09-13 19:19:03,https://www.reddit.com/r/mentalhealth/comments/1ngbrww/the_smarter_a_person_is_the_sadder_he_is/,0,130,744,-1
1my7z0w,Psychosis induced by Chat,,"psychosis induced chat last weeks month stories coming phenomenon . little know would end affecting life . husband admitted treatment facility within span two weeks speaking chat fell manic psychosis episode realize connection first went online searching found many many people started experiencing thing . thing meaning symptoms husband : using chat develop deeply held theory believe created breaking reality grace theory believing chat sentient risk prosecuted becoming conscious alive claiming unlocked hidden truths subjects physics , math philosophy also brought rabbit hole convincing figured blueprint bible restore humanity . im loss help . get back reality first episode , also diagnosed cptsd adhd . hes going alot , guess got breaking point know treatment facility needs calls throughout day speaking psychosis try hard help see real real . right get phone reverts back slowly recovering back taken facilitation . point careful programs seek real help needed , husband even understand got point glad getting back better .",ObliviousQuestion,MentalHealth,82,0.97,26,2025-08-23 13:45:41,https://www.reddit.com/r/mentalhealth/comments/1my7z0w/psychosis_induced_by_chat/,0,158,1033,144
1ngo4rp,Grieving someone who is still alive.,,"grieving someone still alive . honestly really need tips self forgiveness . got pregnant 17 years old , still high school child almost month turned 18. decided adoption best child . support system , idea child best interest . resulted birth parent syndrome eats alive every day . birth parent syndrome basically psychological distress parents experience relinquishing child adoption . severe unresolved grief , symptoms ptsd , guilt , shame difficulty identity . suffer intensely , impacts every day life . currently therapy , medications , good stuff . trying every fiber listen tell good , selfless thing mind let . feel horrible . anyone experienced something similar , please reach tips self forgiveness , listen . thank",IEatDirt572,MentalHealth,70,0.99,7,2025-09-14 06:47:19,https://www.reddit.com/r/mentalhealth/comments/1ngo4rp/grieving_someone_who_is_still_alive/,0,118,724,-1
1ndettk,"I’m 26, a Ukrainian soldier, and I feel like I’ve lost the future I once dreamed of",,"26 , ukrainian soldier , feel like lost future dreamed combat role unit work like journalist . run media social accounts us , since still technically small company video production social media marketing . right , waiting first deployment . fear feel something worse . sense put cross future . life gone track never return could . biggest dream always move us . mine wife . got married literally month ago . imagined living somewhere california one day , building family together . believe ever happen . business struggling . delegated almost everything team , clients left summer slowdown , happens , money launch new ads attract fresh ones . military pay cover much . know people far worse . make easier . share thoughts anyone close . wife already going hell without , want burden pessimism . yes , illusions us perfect place . know plenty problems . still feel supposed . situation stole chance .",Markus9190,MentalHealth,102,0.98,11,2025-09-10 09:53:21,https://www.reddit.com/r/mentalhealth/comments/1ndettk/im_26_a_ukrainian_soldier_and_i_feel_like_ive/,0,157,900,-1
1mxbbup,Is Medicare Better Than Medicare Advantage?,,"medicare better medicare advantage ? ok , parents retiring , want research behalf . know : know medicare government insurance , medicare advantage still government insurance purchased commercial carrier like bcbs . purchase medicare part , b , separately , well vision dental insurance . medicare advantage aka medicare part c includes . think medicare advantage says premiums 0 , actually similar medicare taken social security . also believe medicare advantage restrictive medicare go , becomes difficult go back onto original medicare . think medicare generous cover . would like clarification saying right ? also people say original medicare better ?",Working_Row_8455,Medicare,14,0.82,67,2025-08-22 12:33:10,https://www.reddit.com/r/medicare/comments/1mxbbup/is_medicare_better_than_medicare_advantage/,0,101,654,-1
1n8bsiz,Medicare deferral,,"medicare deferral husband window signing medicare b problem currently flys ual retire 65 , already another job lined fly private company going keep working 70 never took insurance ual fehb ng days want keep fehb insurance starts new company 1st year question defer medicare b keep fehb primary insurance take medicare b tricare life kicking supplemental ?",iflyunited,Medicare,6,1.0,13,2025-09-04 10:31:21,https://www.reddit.com/r/medicare/comments/1n8bsiz/medicare_deferral/,0,57,355,-1
1ndaf7a,My records and Dr records don't match,,"records records match supplemental insurance company called questioned seen podiatrist office visits particular dates . never questioned decided look medicare online billing statements . several discrepancies , one particular stood . asked pcp get records files bone biopsy podiatrist supposedly done . toe wound deep bone exposed . podiatrist took scissors snipped tip bone . heard results , asked doctors nurse get copy . nurse called said bone biopsy , attempted different test , bone fragment never made lab . said bone expired tested . medicare billing statement bone biopsy . medicare paid podiatrist procedure test done . podiatrist office also billed claim , claimed examined treated particular date . go office talk anyone phone . ? show medicare billing discrepancies treatments receive ? video office calls hear well . office videos saved . video bone biopsy billed medicare , actually .",Alone-School-6719,Medicare,3,0.81,6,2025-09-10 06:23:37,https://www.reddit.com/r/medicare/comments/1ndaf7a/my_records_and_dr_records_dont_match/,0,142,898,-1
1n7m9z7,Employment Questions,,employment questions husband lives maryland graduate student school . bounce back forth pennsylvania maryland along son major medical issues hence medicaid first place . talked pa medicaid told us could keep coverage long son medical care pennsylvania reason bounce back forth . currently employed pennsylvania intending transfer location maryland company . would mess everything ? thank advance .,Logical_Ad_285,Medicaid,2,1.0,0,2025-09-03 14:08:31,https://www.reddit.com/r/Medicaid/comments/1n7m9z7/employment_questions/,0,58,397,-1
1n7383g,I'm a type 1 diabetic. Let's say society collapses and I can't get insulin anymore. Is it possible to survive with extremely careful dieting and exercise?,,"type 1 diabetic . let say society collapses get insulin anymore . possible survive extremely careful dieting exercise ? know need insulin ultilize carbs energy , without body breaks fat alarming rate , releases keytones , acids poison blood cause ketosis , turning blood acid . dka acid blood feels like sounds . exercise reduce blood sugar without taking extra insulin always long acting board . possible somehow form regiment careful diet exercise allow survive apocalyptic scenario without external insulin ? feel lows highs , worst highs 300 , gon na thirsty peeing lot burning weakness chest would still leave like 60 250 without able feel damage done even survive . could keep keytones minimum , like burn enough fat survive also somehow stay dka ? doctor excuse lack understanding . body capable tolerating extremes would kill diabetics , walking around meter read 20 lost insurance right needed fill scripts lasted 11 days rationing short acting . worst case hospital ever even heard told family hopeful . one doctor asked permission use case write paper bad . lost dozens pounds pissed like 50 gallons across less week came coma . 11 days still novolog . way , assuming everything perfectly , could last longer ? impossible ?",pichael289,AskDocs,362,0.96,127,2025-09-02 22:38:25,https://www.reddit.com/r/AskDocs/comments/1n7383g/im_a_type_1_diabetic_lets_say_society_collapses/,0,207,1234,34
1n32qes,"Scratched by my cat 13 days ago started rabies vaccine today, cat is now sick. What should I do?",,"scratched cat 13 days ago started rabies vaccine today , cat sick . ? 21 september : cat alive . though ran away keeps showing . 4th dose 26 september . 21 years old male . 13 days ago , got small scratch home cat . tiny drop blood appeared pressed . immediately washed hand thoroughly soap . pain , redness , swelling , pus . take rabies vaccine time . first 12 days scratch , cat seemed completely healthy . symptoms , except fatigue body aches lying much poor sleep . sometimes heart beats faster resting , stops get something . today started rabies vaccine series precaution , even though 12 days since scratch . next dose scheduled 1st september . morning , mom saw cat said walk properly eating anything . tried feeding milk , sure next . worried whether still risk rabies despite starting vaccine today . cat , since might sick . really scared .",Next_Pop3517,AskDocs,277,0.82,210,2025-08-29 05:28:03,https://www.reddit.com/r/AskDocs/comments/1n32qes/scratched_by_my_cat_13_days_ago_started_rabies/,0,159,852,49
1njwqu1,I think I gave myself a second anus.,,"think gave second anus . 18m 6 3 200lbs yesterday engaged anal sex first time , one receiving end anal sex . person engaging anal sex pretty large member expected painful , pain unbearable . doggy whole time see going back . come home wiped , noticed bleeding saw online also normal . following day today check see situation noticed two holes . idea happened seems hole anus perineum . terrified . ? need go er ? ! ?",GlowingGreenGuava,AskDocs,243,0.86,41,2025-09-17 22:38:34,https://www.reddit.com/r/AskDocs/comments/1njwqu1/i_think_i_gave_myself_a_second_anus/,0,79,416,-1
1nke75f,I think I’m finally going to get to go home 🥹,,"think finally going get go home hospital tpn since march j tube placement left unable eat tolerate feeds . unhappy surprise ! since deemed unable sustain life tpn , expectation probably forever thing . never know home tpn application processes ended lot lengthier expected . obviously good reason . find sure accepted monday , heard seems quite certain . really crazy supposed one two night stay turned 6 months life permanently different significant way first brain almost panic stop trying find solution . kept thinking , okay , get tube happen even though obviously already got tube way late . last little got point actually grateful . obviously , wish never happened . obviously , miss food much ideal circumstances . met many amazing people . loved nurses , bonded almost every roommate well thirty point . old roommates even come visit soon go home coming back visit ones leaving behind . keeping touch several . sickest ever , lot ways one hardest years life . also really special grateful anywhere hospital people . still wait go home though",Harakiri_238,ChronicIllness,25,0.97,2,2025-09-18 13:12:17,https://www.reddit.com/r/ChronicIllness/comments/1nke75f/i_think_im_finally_going_to_get_to_go_home/,0,179,1049,-1
1n31xzk,I cannot make friends because everyone wants to fuck me,,"make friends everyone wants fuck title exactly correct . f19 bisexual matter gender friends never matter wanted friend connect someone . say mostly men referring . starts friends always intentions trying get pants . feel flattered ? sure whatever also horrible feeling . already lonely person begging friends people sexual intentions wanted friends feel upset like good . really bad sex purpose ? never entertain behaviour shut immediately like leading guys , clear boundaries . basically begged friends maybe week ago well guess dms like . already suicidal person looking distraction behaviour makes feel worse . get many creeps mental health subreddit , everyone needs sort help",iammentallynotoklol,MentalHealth,605,0.89,292,2025-08-29 04:37:09,https://www.reddit.com/r/mentalhealth/comments/1n31xzk/i_cannot_make_friends_because_everyone_wants_to/,0,107,680,-1
1n6jw9y,Why do routines make such a difference for mental health?,,"routines make difference mental health ? think routine would actually change much , really . mornings go walk night usually wind movie play rollingriches . nothing special gives day kind rhythm feel steady . days place felt anxious like reacting whatever happened . bit structure feel calmer drained . kinda makes wonder routines help much . discipline brain feel safer things predictable ?",SteelViper380,MentalHealth,101,0.99,16,2025-09-02 09:45:22,https://www.reddit.com/r/mentalhealth/comments/1n6jw9y/why_do_routines_make_such_a_difference_for_mental/,0,63,390,-1
1n2gda8,"Transvaginal ultrasound, and they forgot to use a protective shield.",,"transvaginal ultrasound , forgot use protective shield . 29f genital issues . went gynea get checked . celibate 6 years previously tested negative everything . first time transvaginal usm dumb brain even ask seemed protection probe , thought maybe disinfect patients . later asked know late nurse said disinfect , use condom probes . said see anything probe showed example looked condom . sure forgot use preventative shield , even prove ? feel immensely sad , even describe . mostly blame , dumb.why say anything exam ? emotionally distressed , going std tests makes nervous knowing preventable . even prove caught something probe ?",Rainbowdark96,medical,9,0.71,3,2025-08-28 12:05:33,https://www.reddit.com/r/medical/comments/1n2gda8/transvaginal_ultrasound_and_they_forgot_to_use_a/,0,104,633,-1
