id,title,text,cleaned_text,author,subreddit,score,upvote_ratio,num_comments,created_utc,url,is_self,word_count,char_count,cluster_id
1nklvvn,Why am I being forced to use a NP instead of a doctor?  What things qualify for you to not see an NP?,,forced use np instead doctor ? things qualify see np ? confused lot health care appointments going time . multiple types doctors seem want let see actual doctor want see nurse practitioner . point get privilege see actual doctor ? example surprised see np recent physical . demand see doctor instead np ?,johnthrax,medical,50,0.8,34,2025-09-18 18:05:50,https://www.reddit.com/r/medical/comments/1nklvvn/why_am_i_being_forced_to_use_a_np_instead_of_a/,0,53,304,84
1nm268m,When you only hear one side of a telephone call,,"hear one side telephone call yesterday , tech , busily counting pills pharmacist phone patient . actively listening , reciting usual script . . take without food , matter , alcohol medication . pause , fine ; mushrooms . okay , started listening . pharmacist ended call another minute , ask . pharmacist , tell patient drink med , ok shrooms ? ! ? got good laugh , said , patient wanted know could still eat mushrooms food since antifungal med . actually fairly valid question , thought . anyhow , added little levity friday , hope violate rule 2 .",Crystal_Doorknob,Pharmacy,212,0.99,11,2025-09-20 12:08:51,https://www.reddit.com/r/pharmacy/comments/1nm268m/when_you_only_hear_one_side_of_a_telephone_call/,0,101,548,-1
1ncopd2,"Retiring this year, will be signing up for ACA for the first time",,"retiring year , signing aca first time since retiring dec 31st needing aca insurance jan 1 , submit documentation healthcare.gov proving retired explaining magi low ? never used aca currently employer based insurance . wondered expect people . want hiccups . alabama .",kc7959,Obamacare,22,0.94,29,2025-09-09 13:09:14,https://www.reddit.com/r/obamacare/comments/1ncopd2/retiring_this_year_will_be_signing_up_for_aca_for/,0,43,268,-1
1nemf9v,My boyfriends “medical anomaly” is terrifying me,,"boyfriends medical anomaly terrifying allow start , april 2025 kidney pancreas transplant . everything looking good minus hiccups , said , virtually zero immune system . little week ago , started sleeping , point sleeping 20 hours day . mom finally talked going doctor , 104 degree fever . doctor recommended going er immediately , . fever high , automatically assumed infection , started pumping iv full antibiotics . catch , find infection . chest x ray looks great . abdominal ct looks good . blood work looks good . spinal tap seems normal thus far waiting cultures . cultures normal infections negative . stool sample clean . flash forward 2 days ago . fever seems breaking . eating . still sleeping almost 20 hours day . new symptom arising seem get words , short term memory loss , trouble focusing . suppose mri brain later today , still waiting dto hear results . multiple doctors working case absolutely stumped . terrified gon na lose . thoughts could ?",WesternMatter4214,AskDocs,534,0.98,39,2025-09-11 18:22:08,https://www.reddit.com/r/AskDocs/comments/1nemf9v/my_boyfriends_medical_anomaly_is_terrifying_me/,0,169,964,-1
1n23q96,Can you die from an intense panic attack?,,die intense panic attack ? talking panic attack causes blood pressure spike levels like 170 110 heart rate like almost max 180bpm . could potentially put cardiac arrest ? suffer panic attacks often vitals . nothing calms nothing works stop mean like relaxation techniques cause ive never taken meds . watching reality ? show emt told girl panic attack could die nervous quite literally cant stop one high vitals . cptsd . requirements posting : female almost 29 yrs old 5 3 short otherwise healthy overweight 180lbs,Hungry-Break816,AskDocs,121,0.88,58,2025-08-28 01:19:51,https://www.reddit.com/r/AskDocs/comments/1n23q96/can_you_die_from_an_intense_panic_attack/,0,87,515,-1
1myk6m6,So what do we do if we're too sick to work while waiting for disability?,,sick work waiting disability ? like seriously . using money doctor bills qualify health insurance . keep passing suffering extreme pain day . charities suggested 211 call back family . rent due flat broke ? work gives maybe 5 hours week passing . home exhausted nauseous anything .,thefroggitamerica,ChronicIllness,45,0.92,39,2025-08-23 22:36:35,https://www.reddit.com/r/ChronicIllness/comments/1myk6m6/so_what_do_we_do_if_were_too_sick_to_work_while/,0,48,281,-1
1n68z38,My roommate just realized I'm ill,,"roommate realized ill roommate best friend first major fight , got really ill tearful moment freaked , looked like broken said realize hat actually ill bought disability money joke course left hours went friend chronically ill came back upset left . tried explain communicate everything could upset . guess post writing . hurts . signed lease , get , another thing come terms , barrier closeness .",Prize-Substance-4160,ChronicIllness,44,0.94,4,2025-09-01 23:24:17,https://www.reddit.com/r/ChronicIllness/comments/1n68z38/my_roommate_just_realized_im_ill/,0,67,397,-1
1neh7y4,I f*cked up,,"f cked unfortunately made medication boo boo paying price mildly humorous least thought share . anyways , usually double check otc drug interactions take anything , make sure , today forgot . getting sinus headache decided take sudogest appointment afternoon really want turn migraine end missing appointment . prayed headache gods , took meds , everything getting much better t. effort stop headache portion vestibular migraines effectively cancelled meds stop dizziness vertigo portion migraines ended cancel , crawl way bed , laughing . like religiously top googling everything usually paranoid level course one time forget , detriment . already checked make sure emergency room situation , really inconvenience . least head hurt anymore",cat_evans,ChronicIllness,25,0.88,2,2025-09-11 14:54:14,https://www.reddit.com/r/ChronicIllness/comments/1neh7y4/i_fcked_up/,0,113,740,68
1nh6wzh,Fill for one year: pill count and refill?,,"fill one year : pill count refill ? physician . tired refill requests . 90x4 leaves 5 days annual patient coming year . insurance mail pharmacy seems prefer 100x3 . understanding , scripts expire 1 yr. sent 121x3 ? would affect pricing coverage ? would intolerable prescriber pharmacy daily life ? suggestions greatly appreciated !",iamathinkweiz,Pharmacy,29,0.87,66,2025-09-14 19:58:47,https://www.reddit.com/r/pharmacy/comments/1nh6wzh/fill_for_one_year_pill_count_and_refill/,0,55,331,93
1mzzqhh,New pharmacist seeking some advice,,"new pharmacist seeking advice hello , graduated working post grad intern retail pharmacy chain . recently passed naplex waiting results mpje . thought would feel somewhat confident prepared role transitioning pharmacist graduated , honestly feel like enough information memorized medications side effects makes feel like imposter coming expected properly counsel patients medications . course never guess anything look information needed , find looking lot information counseling never seen pharmacists . alone large learning curve job ?",MissionCarry3922,Pharmacy,28,0.97,27,2025-08-25 15:14:04,https://www.reddit.com/r/pharmacy/comments/1mzzqhh/new_pharmacist_seeking_some_advice/,0,76,537,113
1nlpgfd,Really worried about my girlfriend. Is the er an overreaction,,really worried girlfriend . er overreaction girlfriend 20 year old female . know exact weight met anorexia support group really something talk . know underweight . guess bmi say probably 16 17. anorexia bradycardia gets migraines . medical stuff know . got flu something like flu three days ago . started sore throat fever wanting sleep . today asleep couch pretty much day barely moved . sure seen leave couch today actually . every often asked wants popsicle soup something says goes back sleep . super hot . mean temperature . feels really hot touch really pale . midnight kind nervous go sleep sick . feeling like bring er maybe overreacting never girlfriend taken care anyone ? criteria bringing someone flu er ?,Ok-Dingo9484,AskDocs,359,0.98,62,2025-09-20 01:07:51,https://www.reddit.com/r/AskDocs/comments/1nlpgfd/really_worried_about_my_girlfriend_is_the_er_an/,0,123,717,-1
1ngusse,How do I make sure I don’t lose insurance?,,"make sure lose insurance ? mom passed away yesterday health insurance work . 17 type 1 diabetic . know anything dad except first name approximate age staying friends finishing high school . really really need make sure lose insurance . lawyer looking grandparents estate mom inherited make sure get . know money know specifics much soon access . working right , school .",my_first_reddit_,healthinsurance,43,0.98,37,2025-09-14 11:52:12,https://www.reddit.com/r/HealthInsurance/comments/1ngusse/how_do_i_make_sure_i_dont_lose_insurance/,0,63,370,-1
1n2d2vd,Medicare Claim not showing up on UHC Medigap website,,"medicare claim showing uhc medigap website medicare er claim early may approved paid medicare shortly . claim showing uhc website provider sent bill amount uhc pay , g plan . contacted provider said aware g plan . , web portal . said billed uhc , would . thought medicare forwarded bill uhc . seems people think work . wondering contact medicare uhc directly . uhc plan show medicare website .",nsolo1a,Medicare,5,1.0,12,2025-08-28 10:02:45,https://www.reddit.com/r/medicare/comments/1n2d2vd/medicare_claim_not_showing_up_on_uhc_medigap/,0,70,393,-1
1n0g90c,Illinois Estate Recovery Questions,,"illinois estate recovery questions grandma currently chicago . living home title name . mortgage largely paid father including repairs like new roof , replaced garage , redid basement flood expected would leave house father . medicaid long remember . one heart surgery quite doctors visits varying issues . last 3 years started using long term care adult day care home aide know illinois estate recovery . know much expect illinois claw back ? way minimize much state takes back ?",Grouchy-Photograph46,Medicaid,6,0.75,12,2025-08-26 04:27:32,https://www.reddit.com/r/Medicaid/comments/1n0g90c/illinois_estate_recovery_questions/,0,80,480,-1
1n1lub8,Florida. My ex has my kids on Medicaid since her other kid is on it and it covered them all automatically I guess. Can I get in trouble or how should I handle?,,florida . ex kids medicaid since kid covered automatically guess . get trouble handle ? normally standard health insurance job due unemployed moved plan . get job keep medicaid plan ?,UltimateCapture,Medicaid,4,0.75,1,2025-08-27 12:31:10,https://www.reddit.com/r/Medicaid/comments/1n1lub8/florida_my_ex_has_my_kids_on_medicaid_since_her/,0,31,183,-1
1n6lsn3,I don’t know why I’m constantly tired,,know constantly tired 25 fairly fit diet terrible reason feel tired literally time . matter much sleep wake groggy throughout day feel like dragging stay awake . honestly drink energy drink get little rush playing quick game jackpot city feel like half asleep entire day . starting get really frustrating feel like age way energy especially since try take care . eat decently exercise regularly think overtraining anything . yet feels like matter shake constant fatigue . part wonders stress lack proper sleep quality maybe even something medical overlooking . time keep hearing people age feel way maybe common thought . either way sick relying energy drinks get normal day .,Additional_Spray3652,AskDocs,227,0.99,28,2025-09-02 10:58:27,https://www.reddit.com/r/AskDocs/comments/1n6lsn3/i_dont_know_why_im_constantly_tired/,0,111,676,-1
1mzs1ia,🙏 Help Solve Mystery! 🙏,,"help solve mystery ! marks ? pics comments . husband 41m enrolled phase iii clinical trial tangent tenosynovial giant cell tumor tgct , receiving emactuzumab . expected side effects per trial data included edema blotchy rash legs chest . one month ago contracted severe covid 19 high fevers , headaches , chills , diaphoresis , delirium ironically cough congestion . symptoms resolved , abruptly overnight developed diffuse atrophic scars well demarcated , pockmark like depressions distributed thighs torso arms , neck , scalp , migrating lower parts face . prodromal rash , papules , vesicles observed acne . work date : biopsy : nonspecific normal findings complete blood panel : unremarkable evaluated trial investigators dermatologist clear etiology precedent reaction reported prior emactuzumab trials reports lupus overseas trials rash never observed lesions appear progressing past 2 weeks . sudden onset cosmetic impact significantly affected mental health . question : anyone encountered similar presentation atrophic scarring without prior lesions , temporally related viral illness trial drug ? possible differential diagnoses management strategies would greatly appreciated .",JunketMassive8513,AskDocs,83,0.94,9,2025-08-25 10:30:17,https://www.reddit.com/r/AskDocs/comments/1mzs1ia/help_solve_mystery/,0,174,1188,-1
1nisz4t,I want to chit chat: Why does the pharmacy community seem so resistant to advancement?,,"want chit chat : pharmacy community seem resistant advancement ? want chit chat something mind . feel like pharmacy profession resistant innovation expanding scope ? spent undergrad pharmacy school working compounding pharmacy lot custom dermalogics . always thought would interesting pharmacists play greater role areas like aesthetics . many parts europe , completely normal pharmacists administer botox similar treatments . searched topic , honestly surprised many comments said things like would ? trained . administering medications kind rocket science . saw similar reactions concept test treat flu covid . even focused logistics rolling type services busy retail setting . curious mindset . seem like , profession , hesitant even hostile change ? would love hear perspectives !",Zealousideal_Hyena64,Pharmacy,31,0.65,119,2025-09-16 16:34:25,https://www.reddit.com/r/pharmacy/comments/1nisz4t/i_want_to_chit_chat_why_does_the_pharmacy/,0,117,784,113
1nbyw3o,My girlfriend suddenly started talking weirdly.,,"girlfriend suddenly started talking weirdly . , 22 girlfriend 20 f , lately started talking weirdly . arguement us , suddenly starts saying like let go home , go home even though already home . , take home . kinda fucked , happening ? mental illness ? please someone help ! . : thankyou everyone helping providing every piece information . : completely fine , doctor told going sort past trauma home abuse led situation persist . fine . addition , taken drug till .",jobo3uiii,MentalHealth,179,0.94,58,2025-09-08 16:28:11,https://www.reddit.com/r/mentalhealth/comments/1nbyw3o/my_girlfriend_suddenly_started_talking_weirdly/,0,85,465,-1
1n4eqjw,Why do people choose to live? What are we supposed to be doing?,,"people choose live ? supposed ? soo umm . people live ? also strangers worry thought someone elses suicidal thoughts ? especially possibility hardly effect anything around ? people born everyday . get huge life learning moments someone maybe even hundred years already figured . feel like important . someone else born , learn everything , experience everything . perspective timeline . people 100 years later try learn history time period grew . unique perspective life probably like back . work push button machine work . im isolated . im listening distance coworkers hear talking ; everyones getting old , generation , generation . im younger 3 4th people . yet feel like im old time slipping away .",Solutionalps9261,MentalHealth,65,0.96,48,2025-08-30 18:41:31,https://www.reddit.com/r/mentalhealth/comments/1n4eqjw/why_do_people_choose_to_live_what_are_we_supposed/,0,119,702,-1
1mz2z46,Sending a child to inpatient psych.,,"sending child inpatient psych . 8 yr old rough life . nephew raising several years . odd dmdd adhd possibly fasd . 3rd grade yet able complete full year school setting . major disruptive outbursts . hits kicks cusses everything . home whole week school disruptive behavior . school placed alternative program 3 children class . two assistants several therapist working top teacher . disruption bad monday told may need look residential schooling . filled paperwork begin process . thursday bad episode home took er . friday sent inpatient treatment 3 hrs away house . called today absolute tears begging bring home . place 14 days work intense therapy coping skills . guess top needing vent , also wonder one else sent young child inpatient . help ? left tell wants help . gives hope maybe time refuse .",tentacool_kid37,MentalHealth,55,0.97,31,2025-08-24 14:12:37,https://www.reddit.com/r/mentalhealth/comments/1mz2z46/sending_a_child_to_inpatient_psych/,0,139,803,-1
1nb3cqr,"Should my boyfriend go to the ER for this infected cut/ingrown hair? Could it be cellulitis? He is on Bactrim but shin is now swollen, warm, pits when touched, etc. please help",,"boyfriend go er infected cut ingrown hair ? could cellulitis ? bactrim shin swollen , warm , pits touched , etc . please help made post couple days ago regarding boyfriend infected ingrown hai . ended taking advice went urgent care . said infection gave script bactrim . bactrim 2 days , looks lot worse . thing concerns skin pitting . press shin pits leaves indentation . warm touch lots swelling . go back er ? could cellulitis ? please help !",Ilovecinnamorollx,medical,50,0.95,35,2025-09-07 16:06:23,https://www.reddit.com/gallery/1nb3cqr,0,82,445,-1
1mxf3qu,“Complex Lesion” on toddler spine. Is this an issue for pediatric neurosurgery or dermatology?,,"complex lesion toddler spine . issue pediatric neurosurgery dermatology ? started noticing lump 2.5 year olds spine . brought pcp xray , xray fine . decided ultrasound since resolving time revealed complex lesion . lower back measuring 0.7 x 0.7 x 0.4 cm , 0.1 cm skin surface . due shadowing spinal processes exclude tract leading spinal canal . decided refer pediatric neurosurgery said would conduct mri . neurosurgery called today said nurse thinks dermatology issue , although pcp disagrees . sure push see neurosurgery mri go ahead dermatology like suggested . attached best photos lump , larger person , everyone able point right away .",Adventurous-Skirt-14,medical,13,0.94,14,2025-08-22 14:55:57,https://www.reddit.com/gallery/1mxf3qu,0,106,643,-1
1ng0ivn,Medicare terminated,,"medicare terminated mom afford payments tried help time able save , cancelled . able get part b ? would go thru application process ? saturday call anyone . cataract surgery planned later month thrown window ? thanks help .",Juniper_51,Medicare,17,1.0,38,2025-09-13 11:34:35,https://www.reddit.com/r/medicare/comments/1ng0ivn/medicare_terminated/,0,39,223,-1
1n7e8bu,Bill from fire dept following an ER visit,,"bill fire dept following er visit dear , father law visited us us tourist visa rushed er following medical emergency . till date received 2 bills one hospital 4500 submitted financial application based fil personal income able reduce bill 1300 plan pay . one town fire dept responded 911 call sent ambulance . bill also order 4500 ! scoured posts subreddit found one possible solution ignore bill . fil rarely visits us foreign country finances really situation ay . question whether town fire dept would pursue legal action , us citizen , fil ignores bill .",MediocrePractice6354,healthinsurance,15,0.68,53,2025-09-03 09:03:26,https://www.reddit.com/r/HealthInsurance/comments/1n7e8bu/bill_from_fire_dept_following_an_er_visit/,0,96,558,-1
1n5vbg2,Michigan-do I remove my adult child from my household while they are in college,,michigan remove adult child household college trying renewal health benefits confused . child 22 recently moved another city attend college full time . work less part time living expenses paid scholarships grants receive school . provide child financially longer . assume means longer considered part household ? need renew separately ? thank guidance give .,Valentine1979,Medicaid,2,0.67,9,2025-09-01 13:40:07,https://www.reddit.com/r/Medicaid/comments/1n5vbg2/michigando_i_remove_my_adult_child_from_my/,0,55,358,-1
1mzqlm9,Medicaid Personal Needs Allowance for Nursing Home Patient,,"medicaid personal needs allowance nursing home patient sister entered nursing home paying bulk social security patient liability excluding 75 pna connecticut . hesitant manager pna read meticulous recordkeeping necessary aging hesitant take . however , would appreciate advice others better nursing home take care bite bullet handle . sister sound mind able record maintain suitable records expenditures .",Small-Wolf2989,Medicaid,2,0.75,5,2025-08-25 09:32:14,https://www.reddit.com/r/Medicaid/comments/1mzqlm9/medicaid_personal_needs_allowance_for_nursing/,0,58,405,-1
1mz93n1,What could have caused what I witnessed this morning?,,"could caused witnessed morning ? hopefully allowed even though personal medical question . friday morning around 6:30 driving work rush hour notice car front thats front driving fine half mile seem notice light turned green . beep , nothing . folks honking driver lets gas 2 seconds brakes . something right try see driver back windshield noticed driver slumped forward moving . put hazards walk beside car see young man unconscious slumped forward sleeping . knock window , , twice , another man comes tries yelling , nurse ran couple minutes later hear sirens . young man brake applied could wake . someone used window breaking tool break window put car park , moment jolted awake looks around like someone asked anything drink , panicking , eyes wide open , quickly shakes head like light goes unconscious . like going sleep like immediately going limp lifeless instant . ambulance gets rushed hospital , car towed whole rest day trying figure could caused episode . way , awake , alert , sober , frantic . instant , non responsive ?",Asleep_Ingenuity9894,AskDocs,672,0.99,107,2025-08-24 18:10:47,https://www.reddit.com/r/AskDocs/comments/1mz93n1/what_could_have_caused_what_i_witnessed_this/,0,179,1036,-1
1n02tme,Medically-assisted death. I’m going to die in 6 mo. Am I eligible?,,medically assisted death . going die 6 mo . eligible ? severe mental illness see making another 6 months . seen negative impact suicide people want discuss home state death dignity act psychiatrist pcp pursue way leave peacefully . sure whether mental illness counts terminal impacts one eligibility . clear online resources us . disclose state helps . treated year helped . struggling life . mental illness count terminal impact eligibility ? want point immediate risk anything hurt . thank f24,Existing-Client5070,AskDocs,346,0.77,229,2025-08-25 17:11:28,https://www.reddit.com/r/AskDocs/comments/1n02tme/medicallyassisted_death_im_going_to_die_in_6_mo/,0,81,495,-1
1n1u03f,RPHs of Reddit- I’m curious what are your thoughts on compounded semaglutide tablets??,,"rphs curious thoughts compounded semaglutide tablets ? ironically enough , received advertisement semaglutide tablets website called skinnyrx understand within healthcare weight management important , advertising word skinny irks anyway thought losing mind maybe rybelsus came generic , like lost mind earlier month idea entresto came generic . , compounded semaglutide tablets even fda approved actually warning made fda stating stated safety efficacy . market glp 1 agonists getting bit concerning honesty",Curious_Two1631,Pharmacy,62,0.88,33,2025-08-27 17:39:06,https://i.redd.it/02vdxhd1tmlf1.jpeg,0,71,507,-1
1n7tpvw,"Red throat, bleeding gums,  since I was 13, I’m 23M and my mouth in general is very sore",,"red throat , bleeding gums , since 13 , 23m mouth general sore mouth become sore last days . normal red ? ignoring scar hard palette pole mouth kid , seen small red spots present . also sore back left right gums molars back . also spitting bright red blood back throat gums bleeding . also weird white lumpy thing back throat seen left image 3. straight sexually active also prescribed 50mg elvanse adhd . thank",Apprehensive_Cod6782,medical,7,1.0,7,2025-09-03 18:57:09,https://www.reddit.com/gallery/1n7tpvw,0,76,411,45
1mwzhxa,I noticed my Toddler has white patches on tongue.  Any advice is appreciated.,,noticed toddler white patches tongue . advice appreciated . noticed spots back toddlers tongue . come wiping brushing tongue . scheduled dental appointment days wonder anyone knew could . still breastfeed seem pain . .,Weird-Actuary7054,medical,6,0.88,8,2025-08-22 02:58:26,https://i.redd.it/ez7qbgwcrikf1.jpeg,0,35,218,-1
1ncjri3,Health Insurance dropping my doctor and local hospital,,health insurance dropping doctor local hospital health insurance company recently informed dropping doctor closest hospital also one largest health systems area . change happens november 2025. count event could use change insurance company ? since november open enrollment starts freely switch companies ?,ApartmentDry8023,healthinsurance,9,0.91,8,2025-09-09 10:02:02,https://www.reddit.com/r/HealthInsurance/comments/1ncjri3/health_insurance_dropping_my_doctor_and_local/,0,43,305,-1
1narbed,Medigap G & Drs who don't accept Medicare,,"medigap g drs accept medicare seriously considering abg medigap g deductable . leaning towards aarp . plan retire january . question : accept medicare , even full coverage , go visit list ? thanks.b",Apprehensive-Frame25,Medicare,15,0.8,44,2025-09-07 07:58:49,https://www.reddit.com/r/medicare/comments/1narbed/medigap_g_drs_who_dont_accept_medicare/,0,34,198,-1
