id,title,text,cleaned_text,author,subreddit,score,upvote_ratio,num_comments,created_utc,url,is_self,word_count,char_count,cluster_id
1n7z3cm,My partner has a psychotic break yesterday. What happens now?,,"partner psychotic break yesterday . happens ? 40m came home work yesterday walked kitchen started calmly telling 41f accidentally broke timeline working multi verses try fix six year old helping pure soul needed kinds wild stuff . told delusional needed stop . really calm said understood would say get explains etc etc . immediately got best friend husband . spent long time talking husband back went upstairs got ahold sister loves hours away . turns happened , five years ago . going pretty awful divorce , kids six , pandemic , whole town burned . got suddenly delusional , mom sister came took several days talk getting meds helped quickly went back normal . since nothing like ever happened , thought isolated incident , nervous breakdown stress . stress . known three years recently moved together two kids two kids . things wonderful fine . know diagnosed bipolar discussed early relationship . asked looked like episode said gotten depressed past . ok dealing c ptsd , one judge . mad whole story , told really happened . everything wonderful . life fine . kicked . friend husband able get er last night apparently calmly explained staff said seem dangerous keep . agreeable friendly evening . unnerving . near kids especially involving littler one delusions . mom flew today hotel , trying convince go get abilify shot apparently worked last time . know going succeed long take . look like comes , ? understand happened ? need able talk make plans . functional ? depressed ? lose job ? never seen anything like . would really like hear experiences . scared sad .",DearUnderstanding746,MentalHealth,207,0.87,170,2025-09-03 23:05:10,https://www.reddit.com/r/mentalhealth/comments/1n7z3cm/my_partner_has_a_psychotic_break_yesterday_what/,0,272,1572,0
1ndy672,My daughter’s 10 day decline,,"daughter 10 day decline summary daughter past ten days . doctors stumped . ideas suggestions greatly appreciated . summary past 10 days 14 year old girl baseline previously healthy , major medical psychiatric history reported , drug use , family history mental illness , successful socially academically . initial symptoms day 1 3 sudden onset waking 2 3 hours sleep . unable return sleep . episodes anxiety panic attacks , early catatonic symptoms freezing , inability respond first appeared . developed derealization feeling detached unreal . noticed ear discomfort pain still present episodes . progression day 4 7 symptoms escalated daily episodes . typical episodes include : confusion disorientation , emotional distress panic , strange altered experience time , abrupt repetitive movements , transient left sided numbness tingling , ear discomfort . episodes often triggered screens , loud noises , bright lights shining eyes . total loss appetite desire drink water acute crisis day 8 9 experienced massive panic attack . within hours , complete psychotic break : recognize parents believed trying kill paranoid delusions occurred break . marked behavioral change , largely resolved back usual episode pattern . medical workup ct scan : normal mri brain : normal lumbar puncture spinal fluid : normal eeg : abnormal , showing slowing right side brain suggests focal cerebral dysfunction . medication reactions adverse reactions : ativan lorazepam , gravol dimenhydrinate , trazodone , lorazepam significant adverse response noted . current status day 10 continues severe psychiatric neurological symptoms . catatonia escalated : began panic related freezing today progressed 3 minute episode total catatonia . ongoing symptoms include confusion , panic , altered time perception , abrupt movement episodes . psychosis limited one break paranoid delusions event . neurological features : eeg abnormality , left sided numbness tingling episodes , ear discomfort . environmental triggers : screens , loud noises , bright lights . medication sensitivity complicates management . key features abrupt onset within days . predominantly neurological catatonic episodes psychiatric overlay . single psychotic break paranoid delusions ongoing . abnormal eeg right sided slowing despite normal ct , mri , spinal fluid . escalating catatonia medication intolerance . urgent need neurology , psychiatry , immunology collaboration . : today got blood serum results back confirmed anti nmda receptor encephalitis . result made feel simultaneous relief rage . relief began treating form autoimmune encephalitis 5 days ago iv steroids ivig , began show signs improvement almost immediately . rage first neurologist thought psych patient delayed testing 4 days . mri csf clear refused treat pushed hard enough change mind . longer shows signs panic , agitation , catatonia . still gets confused sad , feel like daughter back exhausted version . appetite coming back last night slept 8 hours straight . clearly months fully recovered overall direction upward . slowly tapering ativan , clonidine , trazedone , tomorrow infusion rituximab followed second infusion two weeks . hope go home 2 days . experience torture glad put rear view mirror . express grateful everyone took time read situation offer suggestion , story , support . seriously , thank .",Chachichachichicken,AskDocs,424,0.99,169,2025-09-10 23:13:59,https://www.reddit.com/r/AskDocs/comments/1ndy672/my_daughters_10_day_decline/,0,516,3340,0
1n4hmhw,I'd appreciate some advice,,"appreciate advice hello , stay home mom . family lost health benefits two months ago husband lost job due chronic illness . thankfully , able get onto obamacare soon , paying 0 month family four . however , recently notified cvs pulling state next year , whatever new insurance get onto give us good price . upcoming changes 2026 , begun applying full time jobs would come health benefits , hoping get one soon husband know able return work unfortunately . breaks heart think suddenly away kids , sometimes difficult things . anyway , also weighed another option , freelance work home . took online course taught skill , potential make good money get good get clients . course , purchase health insurance . question would recommend safest option ? fear 2026 comes expiring subsidies , ton people self employed suddenly going flooding workforce , desperate get jobs offer health insurance . want competing . monthly take home husband long term disability insurance 4100 gross . number , anybody know around much monthly premium would jump 2026 , , let say , started bringing home 3k month , total monthly household income would around 7k ? tried calculators online , feel like getting lot conflicting information . advice ? tend financially conservative ; like feel safe back plan back plan : thank !",Chocolatier23,Obamacare,7,0.78,8,2025-08-30 21:01:12,https://www.reddit.com/r/obamacare/comments/1n4hmhw/id_appreciate_some_advice/,0,223,1299,0
1n56o3a,GATEKEEPING Doctor Husband Won’t Answer My Question and I’m now asking the internets.,,"gatekeeping doctor husband answer question asking internets . really hoping gastroenterologist sees answer : question living rent free head far long gatekeeping emergency physician husband laughs whenever bring refuses answer . career , related number cases treated septic patient due nick bowels insert number abdominal surgeries . super scary , super dangerous , apparently far common anyone comfortable . poop gets blood . patient goes sepsis . simple cause effect . butttt pun intended , asked ever seen treated sepsis resulting bleeding ruptured hemorrhoids internal external , looked like crazy , laughed , said t. pressed information : happen ? open wound , poop , sepsis , right ? need know one happens nature unreasonably curious person . brought several times always laughs tells look . dr. google internets send rabbit holes never answer question . vasculature different colon ? like antibiotic slime layer ? know poop still bacteria millions people piles going septic left right ? ! could see argument solid poop might well solid get cut . explosive diarrhea ? please help : tried post think ai thought rhetorical question denied .",You-bettah-dont,medical,97,0.9,36,2025-08-31 17:29:22,https://www.reddit.com/r/medical/comments/1n56o3a/gatekeeping_doctor_husband_wont_answer_my/,0,184,1143,0
1myhmwd,I need my pancreas removed but no one will do it locally and insurance won't let me go out of state.,,"need pancreas removed one locally insurance let go state . stated sick chronic pancreatitis birth defect . everything stay hospital . drugs , alcohol , smoking , super low fat diet . pancreas half dead blockage last doctor said need removed immediately . one wa live previous surgeries . say liability . found place minnesota insurance denied twice . waiting pancreas die probably kill . know tried sign palliative care rejected since cancer .",[deleted],healthinsurance,66,0.91,36,2025-08-23 20:27:21,https://www.reddit.com/r/HealthInsurance/comments/1myhmwd/i_need_my_pancreas_removed_but_no_one_will_do_it/,0,74,443,0
1n4tjbg,Insurance claims 03 poisoning isn't a valid ER visit,,"insurance claims 03 poisoning valid er visit recently went er since know case . janitor local theater one bosses decided run ozone machine left day , forgetting would building next hour clean . leak one closets caused mold problem . district manager thought would good idea run told manager set . truth one read instructions . got theater 12:30 morning started normal cleaning . got little light headed think anything till went pass doors ozone machine running . idea would running night manager tell one building . read warnings machine quickly finished taking trash side building clocked nearly passed car . point googled tried calling friend one friends also worked night shifts , luck . 2am point . light headed made decision go er since nothing else open idea could happen next hour . want passed worse outside work . drove head got little clearer . two streets away . got hard talk reeked whatever ozone cleaner spewing . took vitals high blood pressure find anything wrong , lungs fine . get plenty fresh air okay . mail got bill visit . 600 insurance cover deemed unnecessary visit . thankfully work covering incident happened could suffocated leave building . conceded unnecessary visit ? let pass hospital instead driving minutes home passing ?",Xealas2,healthinsurance,67,0.9,22,2025-08-31 08:34:10,https://www.reddit.com/r/HealthInsurance/comments/1n4tjbg/insurance_claims_03_poisoning_isnt_a_valid_er/,0,212,1254,0
1n56ruy,I am four months (17 weeks) pregnant and I don’t know how I am going to survive any more of this. Someone please help me. I feel like my concerns have been dismissed.,,"four months 17 weeks pregnant know going survive . someone please help . feel like concerns dismissed . 27 , 170 cm tall , last time weighed appt 50 kg , 54 prepregnancy . first pregnancy , medical concerns prior pregnancy , take prenatal vitamin pregnacare zofran currently . obviously longer smoke drink socially prior pregnancy . planned much wanted pregnancy , wits end . every day wake wishing spend entire day wanting die . eat anything . smell food . started perhaps 6 weeks gotten better , fact , seems like getting substantially worse . longer climb stairs home . thing able stomach ginger turmeric hip pop even occasionally gets rejected . hospital midwives regular clinic midwives local hospital london seem concerned said repeatedly normal part pregnancy slow , . given iv drip , give script zofran mainly vomit . baby always looked fine growing normal , dying , want dying . wrong . someone please help ? desperate husband .",Pristine_Film_6190,AskDocs,544,0.97,121,2025-08-31 17:33:53,https://www.reddit.com/r/AskDocs/comments/1n56ruy/i_am_four_months_17_weeks_pregnant_and_i_dont/,0,162,937,0
1nhpg8w,Was it really my fault that my mother died ?,,"really fault mother died ? 16f , mom died august 31 ; 43 years old . august 1 hit head twice row , strong impact , loss consciousness , even hurt anymore . three days later started headache , said felt unwell , pale , went lie sleep . even felt strange sometimes would peek bedroom see breathing , kept wondering something woke said felt better , told would ok , probably migraine . went sleep already evening . next day woke said remember last twenty years life ; said remembered name , even clearly . called ambulance ; hospital told us two areas bleeding brain . seemed strange given minor bump , probably benign tumor nearby , although likely growing , made blood vessels around fragile . also vascular conditions , maybe problems blood clotting , know else . said looked like would recover three months already next day , stabilized , began remember various things looked hopeful . three days hospital clot suddenly formed blocked vessel ; know exactly happened , roughly told . suddenly two emergency operations mom put induced coma . end august also developed infection ; gave strong antibiotics , infection seemed subsiding , died know cause ; heart simply stopped , cpr performed unsuccessful . died one day started new school know anyone , three days 16th birthday . keep blaming called ambulance day head started hurt , already felt strange , would stabilized earlier maybe complication happened . always imagined brain bleed suddenly person gets headache within minutes unconscious , would go sleep evening say feel better . besides , hit head hotel room city gone singer concert , idea go . know , feel like died , even though know judge way . relationship ideal . argued , months happened , almost constant often told would die one day , knew would shut . even know writing ; feel robbed lost mom sixteen year old girl . maybe doctor tell fault , really know expecting . know cope . also sorry english , native speaker .",Sensitive_Can9970,AskDocs,363,0.98,45,2025-09-15 11:45:44,https://www.reddit.com/r/AskDocs/comments/1nhpg8w/was_it_really_my_fault_that_my_mother_died/,0,344,1934,0
1mz482p,I'm Syrian and I hate being alive,,"syrian hate alive reason alive . hate fact end ; truly wish someone would put end life , never planned , imagine , killing . hope maybe things continue get worse , somehow , someday , end . syrian , still live syria . never able leave poor ; . see friends studied profession posting pictures outside country , feel bad . wish stay hell , wish worst enemy wish could get well . time , know problems deeper nationality . however , left , probably would felt like something live , potential things might get better . since never able leave , think state better . perhaps one day get enough courage end miserable existence . make worse , minority background , things much worse us rn . also barely friends . introverted socially awkward . people think negative ; hell , people even told exaggerating , funny think many things worse syrian . also hate place ; hate backward people , hate society . hate obsessed religion . know solutions problems , wanted vent people know .",Ok-Artichoke6197,MentalHealth,168,0.94,80,2025-08-24 15:00:23,https://www.reddit.com/r/mentalhealth/comments/1mz482p/im_syrian_and_i_hate_being_alive/,0,179,969,0
1n9ujgv,I finally got a diagnosis today and I wish I hadn’t.,,"finally got diagnosis today wish t. sick 4 years . times better , last year really bad . finally got referral internal medicine 8 months ago appointment today . doctor lovely . listened , asked questions . appointment supposed 45 minutes ended hour thorough . told cfs , , given symptoms , really tests would run already done . gave lot information next steps , help feeling absolutely gutted . cousin cfs ten years . know debilitating . go away . always careful . always amount sick . always wondering next flare . always poor struggling . always hurt . always loose , stretched skin weird rashes pem brain fog . never get normal life . never able go back girl 4 years ago . used energetic . lived four different countries time 26. right got sick heading japan teach year . friends loved going . loved hiking dog hot yoga sleeping around . life perfect , living terms . think holding onto hope , got diagnosis , get treatment get better . get back level normalcy maybe everything fucking hard time . really keeping going . know live life knowing likely never 100 healthy . feels hopeless unfair . never going get life back . even things get better , still always struggling . know . feel much grief life lost illness much fear life come . turned 29. know supposed rest life . know survive .",ThatCuteNerdGirl96,ChronicIllness,156,0.99,30,2025-09-06 04:43:02,https://www.reddit.com/r/ChronicIllness/comments/1n9ujgv/i_finally_got_a_diagnosis_today_and_i_wish_i_hadnt/,0,238,1291,0
1mye8p8,My wife won’t stop seeing her naturopath doctor.,,"wife stop seeing naturopath doctor . using throwaway wife knows . put bluntly : wife 33f fairly overweight many years . practiced poor self care early 20s something metabolism naturopath doctor diagnosed metabolic disorder . found naturopath , expressed great relief always negative experiences real ? doctors always claimed simply told lose weight could offer treatment , ignored requests woman , offered solutions whatever underlying issues leading weight gain . naturopath listens , says , gives treatment options doctors t. naturopath prescribed variety vitamins supplements herbs spices , jokingly call treat weight gain , stopped taking since beginning breastfeeding second child . prior , taking year . personally witnessed results supplements . naturopath told wife upon cessation breastfeeding , begin give supplements alter hormonal levels mimic experienced pregnancy , time wife swears loses weight . research seems indicate naturopaths quacks lacking rigorous training experience real doctors . naturopath part medical network seems unable prescribe basic stuff . example , suffering one ailment another , call physician either get seen get referral . naturopath seem able provide basic service . ultimately choice wife wants body make , skeptical efficacy naturopath practices since day one . ?",No-Teach9565,AskDocs,390,0.9,84,2025-08-23 17:55:58,https://www.reddit.com/r/AskDocs/comments/1mye8p8/my_wife_wont_stop_seeing_her_naturopath_doctor/,0,195,1307,0
1mxdy12,Health insurance is going up 45%,,"health insurance going 45 work small company offers health insurance industry company size rarely . cover half allows relatively affordable . year going 45 improvement coverage afford help cover additional cost . trying help find options us presented alternatives , seems like risk insurers likely . insurance rates go never drastically , seems like illegal . freaking scam . really asking advice bc idk anyone could , sure common practice . thanks listening .",asheswifey,healthinsurance,163,0.96,7,2025-08-22 14:11:52,https://www.reddit.com/r/HealthInsurance/comments/1mxdy12/health_insurance_is_going_up_45/,0,74,460,0
1nfl8wm,It doesn't matter who but I need YOU to see this.,,"matter need see . looked subreddit platform . see many types people : struggling , coping , lost . feel empty , feel dark , wondering life . therapist . guarantee know 100 help . every method works everybody ok. want say something . proud . proud . proud want speak talk troubles . much courage try find solutions . know get anything standing front . need belief . community safe . supportive . want help . going something , matter severity , . since part , . believe . know . know strong . might think weak true . inside push , need find . know . never feel ashamed reach help support . need therapist , go ahead ! stop . need call hotline ? please . life matters . even seem like right , realize . definitely matters others , family , friends , community . mental health matters . even nobody else tells , know community brings support . get anything believe . proud healing.you gotten far , made much progress . believed change become better version . even started chapter life , okay . finding light dark know . belief flashlight need get dark . went different subreddit found different mental health community . lots people healing proud every one continuing believe get better . know . matter . life . choose want get difficult parts journey . . thank reading .",Mysterious-Pipe-9214,MentalHealth,189,1.0,40,2025-09-12 21:51:05,https://www.reddit.com/r/mentalhealth/comments/1nfl8wm/it_doesnt_matter_who_but_i_need_you_to_see_this/,0,237,1267,0
1mzsu9v,65 in 4 months and Medicare is confusing - some basic questions,,"65 4 months medicare confusing basic questions going talk local ship people read number posts , still confused . turn 65 4 months jan 26 , still working health coverage . hsa , nj think sign part since free harm foul , correct ? wait part b lose job quit retire sign part b penalties issues , correct ? thinking ahead , based reading seems getting part prescription part g medigap instead medicare advantage often better , costs , correct ? one concern bad teeth need going dental care , medicare advantage would cover usually none medicare plans , would need get seperate dental coverage maybe seperate eye coverage hearing coverage , correct ? relative low cost medicare advantage plan vs paying extra part , part g , dental , eye , hearing , tradeoff big azz hmo lots rules could better certainly cost efficient stringing together bunch seperate medicare original plans . right wrong assumptions ? comments suggestions things thinking missing ? know know know one knows , ball park much costing different plans vs one medicate advantage ? thanks lot advance",Repulsive_Pop4771,Medicare,24,0.97,35,2025-08-25 11:00:43,https://www.reddit.com/r/medicare/comments/1mzsu9v/65_in_4_months_and_medicare_is_confusing_some/,0,183,1060,0
1nhiy1r,Doctor says I'm faking for tiktok,,"doctor says faking tiktok hello , 19 dealing heart rate spikes , dizziness , nausea , light headedness , feeling like going pass ect since around 15ish . parent never brought doctors anything never got help things . last years symptoms worsend help girlfriend able go chas establish care last month . let know sure looking symptoms may pointing towards pots . mostly bend get heart rate spikes , used watch showed heart rate spikes , notes saying happens afterwards ect . really want hear . days ago standing test . layed minutes stood . without telling heart rate one time 5 minutes sure results . completely honest felt , later another doctor came said something along lines know popular tiktok , want going around saying dont keep mind use tiktok , never watched people online decided may also . literally looked symptoms could hopefully figure everything . care pots , tests ask notes symptoms told gladly show could figure wrong , told document symptoms come back month , even though . idk happening body exhausting . getting faking tiktok sent depression , feeling like faking right professionals . said rude tone wanted help . gf gave watch checking every time stand . heart rate spikes still . went 64bpm 110 .",Ki_the_creator,ChronicIllness,136,0.89,60,2025-09-15 07:12:33,https://www.reddit.com/r/ChronicIllness/comments/1nhiy1r/doctor_says_im_faking_for_tiktok/,0,212,1218,0
1n5f4zw,Prior authorization for Medicare,,"prior authorization medicare beginning january 2026 people traditional medicare medicare advantage 6 states arizona , new jersey , oklahoma , ohio , washington state texas prior authorizations spine surgery types care . 6 year pilot program . use ai algorithm . seems dangerous consider disruption healthcare insurance companies already use ai algorithms ration healthcare . lot incentive ai companies deny care . ai companies share savings create .",TemporaryKoala4442,Medicare,78,0.99,117,2025-09-01 00:22:42,https://www.reddit.com/r/medicare/comments/1n5f4zw/prior_authorization_for_medicare/,0,68,449,0
1mydv72,Hospital requesting acceptance of responsibility for medical bills not covered by Medicare and Medigap,,hospital requesting acceptance responsibility medical bills covered medicare medigap husband prescribed home sleep apnea test . received bunch forms pre approval receive appropriate devices support home test . stating emergency room event asking accept responsibility charges paid medicare supplemental insurance . hesitant sign forms since appear negate legal protections provided medicare . want consent extra charges outside medicare accepted charges . also want consent facility fees . anyone similar experience ? asking opinions consult medicare aetna . tia,thewebdiva,Medicare,18,1.0,41,2025-08-23 17:40:09,https://www.reddit.com/r/medicare/comments/1mydv72/hospital_requesting_acceptance_of_responsibility/,0,78,562,0
1nao54w,Elderly mother applying for Medicaid to cover nursing home in Washington State,,"elderly mother applying medicaid cover nursing home washington state caring mother 74 home several years . recently declined beyond ability properly care , agreed send local hospital diagnosis , likely trip nursing home rehab returning home . nursing home month , medicare advantage discontinued coverage , realized point may never come home . order cover stay , applying washington state medicaid . owns home , mortgage . live home , become dependent income pay mortgage , essentially pay everything else . think program allows keep income cover home expenses , unclear particular details think time limited . question , medicaid approves coverage , expect happen income ? receives 1300 social security month . understand , without medicaid , nursing home take 90 check .",Mindless-Amount-5966,Medicaid,10,0.72,70,2025-09-07 04:42:41,https://www.reddit.com/r/Medicaid/comments/1nao54w/elderly_mother_applying_for_medicaid_to_cover/,0,124,772,0
