id,title,text,cleaned_text,author,subreddit,score,upvote_ratio,num_comments,created_utc,url,is_self,word_count,char_count,cluster_id
1nabj5f,How do I ask for adequate pain relief without sounding like I’m drug-seeking?,,"ask adequate pain relief without sounding like drug seeking ? 27m , kidney failure transplanted kidney 24 years . basically grown hospitals , past year become call frequent flyer local er probably 50 visits . honestly becoming embarrassing , kidney failure dialysis cause many complications . dealt everything hyperkalemia , svt , peritonitis , kidney infections , prostatitis , c. diff , among many things issue know patients come seeking drugs , especially er , really worry seen way . every single time , legitimate pain , think pretty obvious . tolerance pain meds gotten higher often . example , 0.5mg dilaudid might knock someone used tylenol , barely scratches surface . advocate stronger dose without sounding like chasing meds ? want come across wrong , also want suffer unmanaged pain . joys chronic illness . thank reading . : care pain specialist outside hospital . im talking admitted something else need pain management inpatient .",LunarWanderer77x,AskDocs,419,0.98,90,2025-09-06 17:36:44,https://www.reddit.com/r/AskDocs/comments/1nabj5f/how_do_i_ask_for_adequate_pain_relief_without/,0,156,945,0
1nm3ktr,Is alimony MAGI income?,,"alimony magi income ? sister , 57f , divorcing husband 60m , 28 years marriage . high earner likely paying high alimony 10k per month . sahm entire marriage , health issues , plans work . get medical insurance ? 65 , young medicare . 10k per month alimony count income ? alimony counted , income zero gets medicaid ? hard imagine medicaid since lot assets . tia . : would qualify medicaid , even lots assets ? would option purchase obamacare policy full price ?",SeaweedWeird7705,Obamacare,3,0.6,60,2025-09-20 13:04:03,https://www.reddit.com/r/obamacare/comments/1nm3ktr/is_alimony_magi_income/,0,86,461,0
1ng2yek,Can someone explain malignant hyperthermia to me?,,someone explain malignant hyperthermia ? : told nothing . make . family . n mom long remember . hi 17 mom 34f went play tennis morning . healthy 5 5 135lbs medications . jumped fell leg weird take emergency room . said leg broken needed surgery would fine could probably go home tonight . surgery 2 hours someone came told got malignant hyperthermia need call someone else go home social worker find somewhere go . said also need test . confused one tell anything . drive home wrong mom ? see ? add cancer anything malignant broke leg .,my_first_reddit_,AskDocs,767,1.0,43,2025-09-13 13:11:21,https://www.reddit.com/r/AskDocs/comments/1ng2yek/can_someone_explain_malignant_hyperthermia_to_me/,0,99,536,0
1ne0bx6,Saw Charlie Kirk Death Video on Accident now I’m terrified,,"saw charlie kirk death video accident terrified casually scrolling instagram reels witnessed video , two hours still stuck head . 18 really interested politics little opinions regarding political views , simply informed . seen fair share charlie kirk debate videos social media saw first half read caption thought one saw everything happen close . leaving college ten days horrible feeling anything happen family . found stuck moms hip past hours like little kid stand alone . incredibly graphic even wan na play video games playing guns . dark thoughts world filled much darkness evil stand wan na go see real world . feel deeply scarred video want think anything else . anybody else feeling darkness surrounding horrible event ? also stuff get past instagram guidelines , would anyone wan na subject others viewing ?",Kind_Ad9012,MentalHealth,774,0.8,521,2025-09-11 01:14:37,https://www.reddit.com/r/mentalhealth/comments/1ne0bx6/saw_charlie_kirk_death_video_on_accident_now_im/,0,134,818,0
1nl060z,Maryland Medicaid eventual work requirements question,,"maryland medicaid eventual work requirements question pretty sure unknown far , wanted check . sibling , age 56 , medicaid md due expansion several years ago . diagnosed schizoaffective disorder hospitalized times life . anti psychotic meds compliant . worked many years ago , made work attempts since typically need quit due stress . applied ssi twice denied . work requirements hit , anticipate able obtain job hold job long . volunteer experience recent work history 20 hours week stretch . caregiving 84 year old parents , one alzheimer early stage . anticipated new requirements , hope meeting work requirements combo volunteer elderly parent caregiving ? would elder caregiving , greater 20 hours week , exempt work requirements . see people saying caring kids 14 exemption elderly parents ? thoughts ? btw , sitting couch playing video games .",goetzecc,Medicaid,8,0.84,32,2025-09-19 06:43:54,https://www.reddit.com/r/Medicaid/comments/1nl060z/maryland_medicaid_eventual_work_requirements/,0,139,850,0
1n68m49,Wife tried to kill me today,,"wife tried kill today , wife tried kill today . feels unreal come . small support network stuck working nights worrying ill good dad 2 children . money always big pressure guess whats happend permanent residents canada citizens . im scared legal system . happens . supposed contact kids directly indirectly yet shes already broken 3 hours getting police department . im scared safety kids . need talk someone im feeling low extremely isolated",Hot_Yam_6390,MentalHealth,618,0.98,60,2025-09-01 23:06:09,https://www.reddit.com/r/mentalhealth/comments/1n68m49/wife_tried_to_kill_me_today/,0,74,442,0
1nbixgv,Medicare Wellness Visit,,medicare wellness visit hi ! looking advice deal doctors office . medicare wellness visit last month specifically mentioned nurse doctor reason visit . many visits years well aware rules comes visit . even though wellness visit also charged office visit . going back forth doctors office additional charge . advice wording use doctors office ? charged services provided meaning extra charge office visit . thanks !,fuk-you-tequilla,Medicare,23,1.0,29,2025-09-08 05:16:25,https://www.reddit.com/r/medicare/comments/1nbixgv/medicare_wellness_visit/,0,66,414,0
1nbbwua,They took my 50yr old mother of Medicaid who has an annuerisum and work two jobs but still makes less then 40k a year (NY),,"took 50yr old mother medicaid annuerisum work two jobs still makes less 40k year ny insane , shes even food stamps crippling arthritis , two disjointed hips , blind one eye . kicked literally needs arthritis use . please help said applied give awnser yet . gets denied ? affordable lawyers ?",anonrante,Medicaid,133,0.87,39,2025-09-07 22:24:43,https://www.reddit.com/r/Medicaid/comments/1nbbwua/they_took_my_50yr_old_mother_of_medicaid_who_has/,0,52,291,0
1n5nj0n,is 2025 special?,,2025 special ? paying 80y mil insurance since 2021 move texas ny . eligible medicare medicaid application never approved . file income tax separately 0 income asset . 2025 gold ambetter 1200 1400 month . one 297 month starting january . heard 2026 rate could go would like understand huge drop premium without change situation,loafing-cat-llc,Obamacare,4,0.75,0,2025-09-01 08:36:31,https://www.reddit.com/r/obamacare/comments/1n5nj0n/is_2025_special/,0,55,326,0
1n4hnxb,Gave birth two weeks ago,,"gave birth two weeks ago still waiting bills come assuming . ob prenatal bills added finally well . sure baby insurance work added already started process need ssn . hospital 5 nights 6 days , baby nicu 3 days . induced ; labored ended c section failed vacuum . baby great fortunately , insurance covers ob related care 100 meeting deductible . downside hit deductible twice year got pregnant last december ; insurance runs july june . still grateful though know could much worse . hoping baby care come surprise !",Cheap_Woodpecker4990,healthinsurance,216,0.93,147,2025-08-30 21:03:11,https://i.redd.it/5dmvy6i689mf1.jpeg,0,91,514,0
1nfbgbp,Procedure was non-sedated but anesthesiologist still billed insurance,,procedure non sedated anesthesiologist still billed insurance husband chose completely non sedated colonoscopy also refused sign anesthesiologist consent forms . anesthesiologist still billed insurance paid . sound alarm alert insurance anyone know anesthesiologist would still bill despite administering anesthesia ?,CuriousBusyBee,healthinsurance,76,0.86,137,2025-09-12 14:51:21,https://www.reddit.com/r/HealthInsurance/comments/1nfbgbp/procedure_was_nonsedated_but_anesthesiologist/,0,40,317,0
1njb4sz,My mind feels like it’s looping and I don’t know how to stop,,"mind feels like looping know stop hey everyone , feeling stuck lately . like every morning wake worry already weighing , even nothing bad scheduled . like brain replays ifs even coffee . days get little bits relief : chatting friend , watching something funny , playing slots grizzly quest , going walk . soon alone , rhythm comes back , louder . try journaling , meditation , breathing exercises , nights still end awake hours , feeling like failing calming . anyone else dealt kind repeat loop ? small thing helped break even hour two ?",TitanWarpShade,MentalHealth,156,1.0,17,2025-09-17 07:59:04,https://www.reddit.com/r/mentalhealth/comments/1njb4sz/my_mind_feels_like_its_looping_and_i_dont_know/,0,97,538,0
1n1myvw,What to do if no one will accept your insurance,,"one accept insurance mom lives rural area doctor retired . looking new doctor accepts bcbs hmo find anything . expanded search hour drive received multiple lists providers bcbs . calls everyone list , longer accept plan . health issues needs care rather urgently . ? : originally wrote ppo meant hmo . always confuse bcs head pp bad one .",huffwardspart1,healthinsurance,75,0.96,58,2025-08-27 13:12:10,https://www.reddit.com/r/HealthInsurance/comments/1n1myvw/what_to_do_if_no_one_will_accept_your_insurance/,0,60,338,0
1nl4zto,Why Are Marketplace Insurance Plans So Bad?,,"marketplace insurance plans bad ? context , want retire early looking marketplace plans see get til eligible medicare . however , look really bad . medications covered lot doctors accept plans found . employer plans much competitive . way get plan competitive employers plan marketplace insurance ? find searched . people retire early get good health insurance ?",Working_Row_8455,healthinsurance,48,0.81,87,2025-09-19 10:24:54,https://www.reddit.com/r/HealthInsurance/comments/1nl4zto/why_are_marketplace_insurance_plans_so_bad/,0,58,362,0
1n1w2o2,AARP/United Healthcare Plan G,,"aarp united healthcare plan g , johns hopkins medicine uhc locked pissing contest jh considered network uhc . understanding plan g supplement long doctor provider accepts traditional medicare , plan g would still cover 20 . husband insists wrong , asking anyone versed medicare plan g , insight ? call uhc cx tomorrow , better luck past thanks",YouveBeenWarned213,Medicare,18,1.0,19,2025-08-27 19:03:49,https://www.reddit.com/r/medicare/comments/1n1w2o2/aarpunited_healthcare_plan_g/,0,58,343,0
1nm23y5,Ten prescription drugs will become cheaper in 2026,,"ten prescription drugs become cheaper 2026 ten prescription drugs become cheaper 2026 due medicare drug price negotiations , reduce costs patients medicare part d. remember standalone drug plans medicare advantage plans need checked every year make sure cover drugs taking.the negotiated prices , significantly lower original list prices , go effect january 1 , 2026 , people medicare prescription drug coverage . list 10 drugs . expected lower prices 2026 hard read image profile , seem find place upload image : eliquis : blood clots xarelto : blood clots januvia : diabetes jardiance : diabetes , heart failure , chronic kidney disease farxiga : diabetes , heart failure , chronic kidney disease entresto : heart failure enbrel : rheumatoid arthritis , psoriasis , psoriatic arthritis stelara : psoriasis , psoriatic arthritis , crohn disease , ulcerative colitis imbruvica : blood cancers fiasp : novolog : insulin medications diabetes capped 35 copay",Winter-Leader-9323,Medicare,49,0.98,84,2025-09-20 12:06:19,https://www.reddit.com/r/medicare/comments/1nm23y5/ten_prescription_drugs_will_become_cheaper_in_2026/,0,151,955,0
1n4jtlh,Does anyone else ever consider quitting all tests and treatments because it is just too traumatic? - I want to refuse all treatment.,,"anyone else ever consider quitting tests treatments traumatic ? want refuse treatment . 11 years chronic illness mess tired want quit . want get treatment anymore . want get tests . gotten mris , eegs , colonoscopys , ecgs , heart monitors , gastric emptying tests , unnamed gi tests , list goes . experienced medical abuse . entered territory ivs want go back gi look body absorbing nutrients . anymore . want stop get worse , . already feeling horrible , might well live feeling like without stuck inside white walls hospital . sickness taken everything keep giving doctors unable help nothing traumatize .",Head-Tomatillo-9847,ChronicIllness,157,0.99,45,2025-08-30 22:53:51,https://www.reddit.com/r/ChronicIllness/comments/1n4jtlh/does_anyone_else_ever_consider_quitting_all_tests/,0,105,608,0
1ncr0g3,Can I ask my doctor not to tell my mom my weight,,"ask doctor tell mom weight 13f 5 3 109lbs hi . question probably gon na make seem like brat like snotty teenager swear like . love mom general bad mom . nosy , thinks entitled know every little thing like right tell everyone anything . stand . want anyone knowing business unless tell . one thing one actually knows real life want control information . talked care . says mom want gave life big deal . whatever . maybe bothers . anyway one thing obsessed like weight . used really skinny kid , . much anymore . ever tell weigh pisses keeps saying find next appointment . want know . bring weird times talk 100 pounds make weird comments hate thinking entitled know everything . self satisfied gets way makes want puke . control anything . even talk stuff doctor find . really want know weight . get scale ? tell tell ? really sorry stupid thing ask . actually really bothered though feel anxious sick stomach thinking .",bunnbunn78,AskDocs,496,0.96,126,2025-09-09 14:34:05,https://www.reddit.com/r/AskDocs/comments/1ncr0g3/can_i_ask_my_doctor_not_to_tell_my_mom_my_weight/,0,169,919,0
1nldnpc,How do you explain liver mortis to a seven year old child? (From a widower's perspective),,"explain liver mortis seven year old child ? widower perspective hi , weeks ago . found fiancée bed passed away . time found , passed away middle seizure , rigor mortis liver mortis set . face bed parts facing bed turned stiff blue . attempted cpr desperation already knew gone . calling 999 , talk ems , called younger brother panic . screamed phone walked turned stiff blue cold . calls wife , entire call speakerphone regrettably overheard autistic daughter inquisitive . asked question turned blue , asking aunty . meeting weekend actually terrified explain asks mean person turns blue . mum idea say people turn smurfs . . given background sar . exactly inclined . fiancee also sar , also early years child education experience , know answer . regrettably , skills . ideas tackle one ? far asked fiancee like etc .",Prestigious-Shirt325,medical,77,0.99,16,2025-09-19 15:53:31,https://www.reddit.com/r/medical/comments/1nldnpc/how_do_you_explain_liver_mortis_to_a_seven_year/,0,144,818,0
1n4a66l,Kicked off Medicaid for getting braces? WI,,kicked medicaid getting braces ? wi trying pay pocket sister braces mom medicaid covered . mom saying get medicaid taken away see money afford something expensive braces . sounds stupid never heard . gon na let little sister get braces desperately needs .,wellsmichael380,Medicaid,84,0.86,78,2025-08-30 15:22:08,https://www.reddit.com/r/Medicaid/comments/1n4a66l/kicked_off_medicaid_for_getting_braces_wi/,0,43,255,0
1mx9lk6,What's a weird habit you developed during lockdown that you still do?,,"weird habit developed lockdown still ? thinking pandemic changed daily routines ways probably expect stick around . years curious others still holding onto random habits picked initial lockdown months . , started talking houseplants like coworkers video calls also started gaming myprize . began joke fill silence somehow became whole routine give daily day . still catch even though back actual office . wondering quirky habits others developed never went away ? start wearing one type clothing ? develop elaborate coffee rituals ? fascinating brains adapted unusual time changes ended becoming permanent parts routines . would love hear stuck around , weirder better !",Same_Chard_1083,MentalHealth,213,1.0,29,2025-08-22 11:28:13,https://www.reddit.com/r/mentalhealth/comments/1mx9lk6/whats_a_weird_habit_you_developed_during_lockdown/,0,104,670,0
1n6uu2r,No 2025-26 COVID-19 Vaccine Medicare Coverage,,"2025 26 covid 19 vaccine medicare coverage went walgreens today pick prescription get flu shot . offered new 2925 26 covid 19 vaccine . however , later informed medicare insurance cover . asked people different insurance could get shot , said yes . medicare slow rfk jr shenanigans ? : got covid 19 vaccine 4 days later walgreens .",Omaha-Dude,Medicare,53,0.83,77,2025-09-02 16:36:15,https://www.reddit.com/r/medicare/comments/1n6uu2r/no_202526_covid19_vaccine_medicare_coverage/,0,59,331,0
1nl526w,My dad drinks 2 or 3 jars of pickle juice every day to stop his leg cramps,,"dad drinks 2 3 jars pickle juice every day stop leg cramps dad 65 , typical problems 65 year old american . heavy smoker , liver disease , unstable blood sugars , high blood pressure , copd , forth . also spinal fusion , neuropathy , nerve damage everywhere 180lbs think . always intense miserable leg cramps , years going . doctor , think myriad health problems way source problem found . buys 24oz jar pickles guzzles juice every time leg cramp happens . mostly happen laying sleep . pickle juice even anything ? told dehydrating . says isnt drinks 64oz water every day . think pain medicine doctor told drink pickle juice thinks keep drinking cramps stop , problem dont ever really stop , keeps drinking juice hoping eventually",Desirai,AskDocs,337,0.95,95,2025-09-19 10:27:26,https://www.reddit.com/r/AskDocs/comments/1nl526w/my_dad_drinks_2_or_3_jars_of_pickle_juice_every/,0,130,730,0
1njxhv2,Why won’t they give my daughter’s ovary back?,,"give daughter ovary back ? please talk go full karen haha . daughter diagnosed cancer muscle two years old looking two years gruelling treatment least . early process offered take ovary store cryogenically would one healthy ovary work post treatment . seven years old , three years treatment healthy . asked repeatedly please ovary back yet keep giving non committal answers make sense . today asked said absolutely get back post puberty probably till wants children . asked made sense leave ovary freezer twenty years rather put back . doctor said call proper cancer doctors ask . asked worried puberty experience since got one chemo radiation addled ovary rather two regular ones . said fine monitoring puberty closely . asked put back monitor regular amount real answer . know took ovary said could guise study . asked back years ago treatment done said done many wait till routine done thing get better result . heard comment many times asked following . remark mentioned monitoring puberty makes feel like using test subject makes uncomfortable want conspiratorial . study funding storage runs year means pay 700 year keep ovary ice . mind , another thing family think . healthcare system getting shaky thought option things go right hormonally freezer instead body point time feel right . anybody insight answers could give really appreciate .",Arterially,AskDocs,456,0.91,62,2025-09-17 23:16:09,https://www.reddit.com/r/AskDocs/comments/1njxhv2/why_wont_they_give_my_daughters_ovary_back/,0,222,1349,0
1nbu9om,18F dark dry mark developed under my right breast over the course of a week,,"18f dark dry mark developed right breast course week course week , noticed small dry patch right breast . thought nothing , moisturized area , made sure moisture trapped , went day . today check breast turns got worse ! think important mention pain discomfort ! medicine take , consistent , 10mg prozac prescribed . first photo left breast second photo right breast . something goes away schedule appointment ? fix home please tell ! less doctor visits , better . please help !",Thick_Cheek6308,medical,27,0.94,12,2025-09-08 13:35:48,https://www.reddit.com/gallery/1nbu9om,0,84,477,0
1na3601,"19yo with CP, 100+ Care Hours, Facing 2-Year Waiver Waitlist” indiana",,"19yo cp , 100 care hours , facing 2 year waiver waitlist indiana hi everyone , need medicaid help . background : 19 living dorm room spastic quadriplegic cp , since birth . require 100 hours caregiving per week 15 hours day , 7 days week . attend school indiana originally new jersey . caregivers assist everything toileting bathing getting dressed morning . care currently provided home health care agency , live college dorms . understanding , need health wellness waiver . process applying told two year waitlist . leaving college option . prior college , never needed aides parents provided caregiving . initially regular medicaid first born , eventually got kicked . considered privately hiring current caregivers , would reduce costs 40 , hire outside agency , caregivers risk sued agency . possibly ? reaching school option since extremely small .",Notre-dame-fan,Medicaid,11,0.91,5,2025-09-06 11:59:00,https://www.reddit.com/r/Medicaid/comments/1na3601/19yo_with_cp_100_care_hours_facing_2year_waiver/,0,142,854,0
1ncwg5s,I ripped my nail off right before a wedding - will it grow back??,,"ripped nail right wedding grow back ? ripped nail due fake nails . grabbing suitcase whole thing , real nail ripped . kept clean continue put antibacterial gel . 5 days since incident . hurt unless wack something obviously . currently cruise happened right boarded go doc unless want fork thousands ship doc . hurting infected worried . need know going actually grow back ? hanging thread whole wedding rip able get room . picture shows deep nail actually freaked bit . pictures right ripped . p.s . pinky crooked since born . broken .",Sneakythreat,medical,62,0.96,27,2025-09-09 17:58:33,https://www.reddit.com/gallery/1ncwg5s,0,95,535,0
1mzf38f,Where is my foreskin?! I had it removed when I was a baby. What do they do with it?,,"foreskin ? ! removed baby . ? randomly sitting thought foreskin . removed young baby , go ? storage somewhere ? throw garbage ? foreskin still exist recycled back earth ? use skin grafts patients ? . ? let ? idk right subreddit people know . something quite sit well .",Advanced-Citron8111,medical,29,0.72,24,2025-08-24 22:44:34,https://www.reddit.com/r/medical/comments/1mzf38f/where_is_my_foreskin_i_had_it_removed_when_i_was/,0,51,268,0
1nhoxcz,I’m sick of this “residency or bust” culture,,"sick residency bust culture short context working hard workplace past 5 years licensed pharmacist even longer student . one left essentially knows everything place . head supervisor stepped year originally appointed take , workplace said need job search . going , putting extra time extra pay essentially work supervisor . extra pay thing huge deal deeply love place wanted mention . today , got informed get position . asked , told residency . hiring someone graduated residency july never stepped foot building . despite actual , proven knowledge experience specific environment , despite team advocating , hiring unknown literally residency factor . need rant absolutely insane . piece paper worth actual , specific experience recommendations team ?",General-Wonder-6827,Pharmacy,339,0.97,92,2025-09-15 11:26:19,https://www.reddit.com/r/pharmacy/comments/1nhoxcz/im_sick_of_this_residency_or_bust_culture/,0,117,752,0
1nfunrv,does anyone else’s brain refuse to chill?,,"anyone else brain refuse chill ? swear brain overthinking button stuck . like replaying convos days ago stressing things even happened yet . draining even try relax , mind finds something new stress . curious anyone else relates ? usually thoughts slow ? feel like might learn good tricks hearing others cope . also kinda comforting know one",chickennuggetsplz,MentalHealth,418,1.0,43,2025-09-13 07:01:45,https://www.reddit.com/r/mentalhealth/comments/1nfunrv/does_anyone_elses_brain_refuse_to_chill/,0,58,341,0
1n0t8j2,What could this be? Could it be a burn? It is on my 1.5 year olds leg since yesterday. I’m overthinking the worst.,,could ? could burn ? 1.5 year olds leg since yesterday . overthinking worst . noticed yesterday 18 month olds leg yesterday . say got know . goes daycare dropped notice evening . thought might imprint something still . first pic last night second pic morning . kind raised bothers touch . could burn ? mind thinking worst something happened daycare . talked main daycare lady today clue . asked ask lady new ideas . want point fingers could anything freaking . never suspicion anything bad daycare course think worst time . checked house car seat nothing cause imprint .,cheeeese1234,medical,37,0.92,21,2025-08-26 14:07:30,https://www.reddit.com/gallery/1n0t8j2,0,100,570,1
