id,title,text,cleaned_text,author,subreddit,score,upvote_ratio,num_comments,created_utc,url,is_self,word_count,char_count,cluster_id
1mx4yme,There is a new movement on TikTok from many doctors claiming that insurers are “infringing on their practice of medicine” Have denials on medical nessecity gone up recently for you?,,new movement tiktok many doctors claiming insurers infringing practice medicine denials medical nessecity gone recently ? normally share lot doctors tiktok :,YogurtclosetOpen3567,healthinsurance,554,0.98,237,2025-08-22 08:20:02,https://www.reddit.com/r/HealthInsurance/comments/1mx4yme/there_is_a_new_movement_on_tiktok_from_many/,0,22,157,0
1mvkoso,My employer dropped me from health insurance,,"employer dropped health insurance year half ago became eligible health insurance new job one reasons accepted position benefits . month coverage asked come meeting . insurance broker along director operations . broker explained continued coverage coworker premiums would go high one could afford . said could longer cover would send someone help sign coverage marketplace someone . questioned legal told policy written , yes , legal drop . also add breast cancer survivor . still get preventative treatment monthly local cancer center . first claim submitted center went . legal ?",InternationalStar318,healthinsurance,207,0.96,87,2025-08-20 13:05:25,https://www.reddit.com/r/HealthInsurance/comments/1mvkoso/my_employer_dropped_me_from_health_insurance/,0,91,580,0
1nffrca,"2026 ""Medicare And You"" handbook now available",,2026 medicare handbook available got email . covers lot answers questions often posted sub . downloaded,Savings_Blood_9873,Medicare,39,0.99,22,2025-09-12 17:40:49,https://www.reddit.com/r/medicare/comments/1nffrca/2026_medicare_and_you_handbook_now_available/,0,16,103,0
1mw3md7,"Under 65, disabled & on medicare advantage, can't afford Rx copays",,"65 , disabled medicare advantage , afford rx copays ssdi , choice health insurance medicare , prohibitively expensive use advantage plan one . problem running illegal apparently use co pay assistance program pharma companies either traditional medicare advantage plan . afford medication help . qualify medicaid qualify patient assistance programs classified co pay assistance . pharma companies flat laughed tried get help paying prescriptions , say got medicare bad . yes know capping prescription costs around 2000 would mean spend 2000 . helping either . liminal space make slightly much ssdi qualify patient assistance medicaid enough pay medication . people pay meds situation forbidden use copay assistance ? seems really unfair already poor ssdi allowed rx copay help someone makes private insurance access .",Holiday_Record2610,Medicare,17,0.95,45,2025-08-21 02:46:19,https://www.reddit.com/r/medicare/comments/1mw3md7/under_65_disabled_on_medicare_advantage_cant/,0,124,816,0
1n5rbvr,Humana not paying Bills,,"humana paying bills mom nursing home texas , humana years stroke unfortunately became poa . left everything exactly put since went nursing home , facility calling emailing , saying humana paying bills . putting mom jeopardy loosing room happen . care mom severe dementia paralyzed completely one side makes unrealistic live . facility decent good ones know humana paying facility ? found enrollment october , think best option switching ? would mess mom stay facility ? insight would welcome . thank !",DIY_SelfHelp,Medicare,16,0.94,39,2025-09-01 11:12:10,https://www.reddit.com/r/medicare/comments/1n5rbvr/humana_not_paying_bills/,0,82,501,0
1n5a8r5,My medicaid got cancelled on 7/31 because of my increase in income,,"medicaid got cancelled 7 31 increase income oregon work pharmacy tech . salary increases work summer 40 hours salary 27 hour . going back pharmacy school fall work 1 day week . reapply medicaid income decreases significantly ? look summer paycheck decline ? medicaid 5 years , first time cut medicaid . thank much !",Neeph88,Medicaid,8,0.6,21,2025-08-31 20:12:00,https://www.reddit.com/r/Medicaid/comments/1n5a8r5/my_medicaid_got_cancelled_on_731_because_of_my/,0,55,315,0
1nibj76,"something in my head keeps telling me that I am Napoleon Bonaparte , I'm literally a 19 y.o female",,"something head keeps telling napoleon bonaparte , literally 19 y.o female okay feeling like since last week making feel embarrassed . stop stop reading watching youtube videos , personal life , wars everything yesterday class , minding business , suddenly inner voice goes full napoleon . literally said loud , enemies many , equals none , shades olive trees said italy could never conquered . people looked like announced new dean . wanted cry disappear form thank god kind thought trying make laugh . roomate well family , cats idea came normal college girl , historical cosplay , yet apparently brain auditioned period drama . sleep deprivation thing ? start practicing bicorne hat salute call campus health ? going psychosis ? 19f ,",Flora_musa,AskDocs,1156,0.94,72,2025-09-16 04:09:29,https://www.reddit.com/r/AskDocs/comments/1nibj76/something_in_my_head_keeps_telling_me_that_i_am/,0,123,736,0
1mwpa3y,I have been on my period every day for the last 8 years,,"period every day last 8 years one cursed evil day 12 , got period time supposed , never ended 20 y.o . every doctor gone person mentioned said never seen genuinely feeling hopeless . flow insanely heavy ever since first period 9 y.o . slowed . constantly changing pad tampon leak every hour . pass clots almost every day often experience menstrual cramping . gotten ultrasounds done always show unusually thick uterine lining , makes sense constantly shedding . lining blood regenerate frequently multiple surgeries pump backed blood stomach remove excess lining . also cysts removed 15 diagnosed pcos around age . tried every form birth control none worked currently nothing . feel utterly hopeless exhausted every day thinking never end sick . ruined many pairs underwear pants ridiculous . anyone ideas happening ?",Dizzy-Knowledge-7113,AskDocs,596,0.96,96,2025-08-21 18:27:26,https://www.reddit.com/r/AskDocs/comments/1mwpa3y/i_have_been_on_my_period_every_day_for_the_last_8/,0,134,817,0
1n880dl,RFK Jr. and Trump silenced a groundbreaking report on cancer and alcohol,,rfk jr. trump silenced groundbreaking report cancer alcohol,DonManuel,Health,1493,0.98,61,2025-09-04 07:52:09,https://www.vox.com/health/460086/rfk-jr-trump-maha-cancer-alcohol-study-health?utm_source=reddit&utm_medium=gift-link&utm_campaign=dhfacebook&utm_content=null&view_token=eyJhbGciOiJIUzI1NiJ9.eyJpZCI6Ikk4anpRdlA2cnEiLCJwIjoiL2hlYWx0aC80NjAwODYvcmZrLWpyLXRydW1wLW1haGEtY2FuY2VyLWFsY29ob2wtc3R1ZHktaGVhbHRoIiwiZXhwIjoxNzU4MTkyMjk3LCJpYXQiOjE3NTY5ODI2OTd9.UTVzeEkwCqxYAgT3_ivnSXi094YjrVxZmcspjwr0EAI,0,8,59,0
1n0m92c,America’s leading physician groups are now openly defying RFK Jr.,,america leading physician groups openly defying rfk jr .,vox,Health,1438,0.98,50,2025-08-26 09:44:14,https://www.vox.com/health/459226/rfk-jr-trump-covid-vaccine-ban,0,9,56,0
1n9emxq,People can’t get COVID vaccines as cases surge. Anger is building against Trump,,people get covid vaccines cases surge . anger building trump,EdOfTheMountain,Health,1304,0.97,116,2025-09-05 15:30:37,https://www.latimes.com/california/story/2025-09-05/covid-vaccines-are-harder-to-get-under-trump-and-people-are-angry-about-it,0,10,60,0
1mxa19d,"New mRNA Cancer Vaccine Delivers Stunning Results, Sparks Universal Treatment Hopes",,"new mrna cancer vaccine delivers stunning results , sparks universal treatment hopes",Silly-avocatoe,Health,1279,0.99,54,2025-08-22 11:44:35,https://scitechdaily.com/new-mrna-cancer-vaccine-delivers-stunning-results-sparks-universal-treatment-hopes/,0,12,84,0
1n7hj6j,"More than 1,000 current, former HHS employees sign letter demanding RFK Jr. resign",,"1,000 current , former hhs employees sign letter demanding rfk jr. resign",yahoonews,Health,1049,0.98,18,2025-09-03 11:14:46,https://www.yahoo.com/news/articles/more-1-000-current-former-144606472.html,0,12,73,0
1n5wfvz,Former CDC Officials Say Americans Should Be Alarmed By What RFK Jr. Has Done To Health System,,former cdc officials say americans alarmed rfk jr. done health system,huffpost,Health,1017,0.98,36,2025-09-01 14:21:35,https://www.huffpost.com/entry/ex-cdc-leaders-rip-rfk-jr_n_68b5a89ae4b0bdebd5aa86be?utm_medium=Social&utm_source=reddit&utm_campaign=us_main,0,11,69,0
1n43iyg,The new head of the CDC has no training in medicine and once helped Peter Thiel develop man-made islands floating outside U.S. territory,,new head cdc training medicine helped peter thiel develop man made islands floating outside u.s. territory,PDubsinTF-NEW,Health,845,0.98,37,2025-08-30 10:49:48,https://fortune.com/2025/08/29/who-is-jim-oneill-acting-head-cdc-peter-thiel-robert-kennedy/,0,16,106,-1
1n7oy3z,Florida Moves To Bring Back Childhood Polio,,florida moves bring back childhood polio,huffpost,Health,750,0.97,33,2025-09-03 15:48:30,https://www.huffpost.com/entry/florida-schools-vaccine-mandates_n_68b8789be4b042094ad00a4e?utm_medium=Social&utm_source=reddit&utm_campaign=us_main,0,6,40,0
1n3lexf,"RFK Jr.’s damage to the CDC is ‘past the point of no return,’ Dr. Demetre Daskalakis warns",,"rfk jr. damage cdc past point return , dr. demetre daskalakis warns",duderos,Health,711,0.98,15,2025-08-29 18:36:53,https://www.advocate.com/politics/demetre-daskalakis-cdc-resignation-interview,0,12,67,0
1mw6ugv,There’s Something Very Dark Happening to Millennials and Gen Z Adults,,something dark happening millennials gen z adults,Maxcactus,Health,655,0.95,125,2025-08-21 06:10:01,https://slate.com/technology/2025/08/millennials-gen-z-death-rates-america-high.html,0,7,49,0
1n9c7na,"Kennedy and HHS to link use of Tylenol use in pregnancy to autism, WSJ reports",,"kennedy hhs link use tylenol use pregnancy autism , wsj reports",yahoonews,Health,640,0.96,172,2025-09-05 13:56:17,https://www.yahoo.com/news/articles/kennedy-hhs-tylenol-pregnancy-autism-175002163.html,0,11,63,0
1mvc93a,RFK Jr. Vowed to Find the Environmental Causes of Autism. Then He Shut Down Research Trying to Do Just That.,,rfk jr. vowed find environmental causes autism . shut research trying .,propublica_,Health,597,0.98,14,2025-08-20 07:33:45,https://www.propublica.org/article/rfk-jr-autism-environment-research-funding,0,12,71,0
1naaql0,Clinic Workers Fired for 'Outright Violation' of Policy After Posting Photos Mocking Patients' Pap Smear Discharge,,clinic workers fired outright violation policy posting photos mocking patients pap smear discharge,Forward-Answer-4407,Health,525,0.99,25,2025-09-06 17:02:39,https://people.com/clinic-workers-fired-for-outright-violation-of-policy-after-posting-photos-mocking-patients-pap-smear-discharge-11803181,0,13,98,0
1njketd,"U.S. vaccine guidance is in chaos, fired CDC director tells senators",,"u.s. vaccine guidance chaos , fired cdc director tells senators",scientificamerican,Health,540,0.99,14,2025-09-17 13:59:50,https://www.scientificamerican.com/article/vaccines-are-at-risk-fired-cdc-director-warns-senators/,0,10,63,0
1nde2se,"Just 1 in 4 Americans believe Trump administration vaccine shifts are based on science, Reuters/Ipsos poll finds",,"1 4 americans believe trump administration vaccine shifts based science , reuters ipsos poll finds",yahoonews,Health,527,0.99,32,2025-09-10 09:22:07,https://www.yahoo.com/news/articles/just-1-4-americans-believe-100430636.html,0,15,98,0
1nbp7xb,Florida surgeon general says he doesn't need to study impact of ending vaccine mandate,,florida surgeon general says need study impact ending vaccine mandate,yahoonews,Health,525,0.96,56,2025-09-08 10:28:01,https://www.yahoo.com/news/articles/florida-surgeon-general-says-doesnt-185136592.html,0,10,69,0
1mwgo3a,750 HHS staff send letter to RFK Jr. asking him to stop spreading misinformation,,750 hhs staff send letter rfk jr. asking stop spreading misinformation,yahoonews,Health,514,0.97,11,2025-08-21 12:59:09,https://www.yahoo.com/news/articles/750-hhs-staff-send-letter-181000873.html,0,11,70,0
1n1vh14,"CDC director pushed out, flood of top resignations follow",,"cdc director pushed , flood top resignations follow",progress18,Health,504,0.99,22,2025-08-27 18:38:34,https://www.nbcnews.com/health/health-news/cdc-director-monarez-out-confirmed-rfk-jr-rcna227620,0,8,51,0
1nfhu31,"RFK Jr.’s CDC may limit COVID shots to 75 and up, claim they killed kids | A battle is brewing over mRNA vaccines, which could intensify backlash against Kennedy.",,"rfk jr. cdc may limit covid shots 75 , claim killed kids battle brewing mrna vaccines , could intensify backlash kennedy .",chrisdh79,Health,482,0.97,30,2025-09-12 19:08:20,https://arstechnica.com/health/2025/09/covid-shot-access-could-tighten-rfk-jr-may-claim-they-cause-child-deaths/,0,22,122,0
1neoj6v,Los Angeles County child dies of rare measles complication years after infection,,los angeles county child dies rare measles complication years infection,cnn,Health,448,0.99,11,2025-09-11 19:58:49,https://www.cnn.com/2025/09/11/health/measles-california-child-sspe?utm_medium=social&utm_source=reddit,0,10,71,0
1ncy06l,Just wanted to say that being chronically ill is so damn lonely.,,wanted say chronically ill damn lonely .,ChronicallyTiredLol,ChronicIllness,323,1.0,78,2025-09-09 19:03:30,https://www.reddit.com/r/ChronicIllness/comments/1ncy06l/just_wanted_to_say_that_being_chronically_ill_is/,0,7,40,0
1mvrmi5,Not a 'drug seeker'. Not exaggerating. Here's what Sickle Cell patients want healthcare workers to know.,,"drug seeker . exaggerating . sickle cell patients want healthcare workers know . lived sickle cell entire life . also paramedic , sides bed . seen hard healthcare workers push every day , respect hell . 5 things sickle cell wish every nurse , doctor , medic truly understood : 1. drug seekers . say pain 10 10 , exaggerating . sickle cell pain feels like hot magma mixed broken glass bones , like crushed inside . opitates luxury us , survival . stigma face ers makes one hardest parts disease even harder . 2. hydration optional simple iv fluid bag make huge difference . dehydration one fastest ways tip us crisis , beg endlessly one . please underestimate much helps . 3. fatigue baseline . live constant state tired . lazy . unmotivated . exhausted blood cells carry enough oxygen way . look wiped , try unfortunate reality body . 4. crises look every single one us . one patient might scream grovel agony , another might go quiet . vitals entire reflection feel , either . doctors tell vitals fine must imagining . bodies miraculous ; bodies adapt compensate everything going within us . also crises doubled agony , struggling breathe , ones looked fine felt like dying inside . please assume lack drama means lack pain . 5. compassion changes everything . best care ever gotten came nurse walked warm blankets even asked , came pitcher water asked . small gesture like turn something terrifying something survivable . expect perfection ; hope seen human burden . know healthcare stretched thin . know every provider time sit listen say . people sickle cell , even little understanding could difference dismissed treated like matter . thank reading , thank letting share . healthcare treated taken care sickle cell patients , love hear perspective .",6ixexe,ChronicIllness,243,0.99,38,2025-08-20 17:16:24,https://www.reddit.com/r/ChronicIllness/comments/1mvrmi5/not_a_drug_seeker_not_exaggerating_heres_what/,0,305,1754,0
1mw0lcy,Why do doctors not tell you things?,,"doctors tell things ? back 2022 ended hospitalized 3 kidney stones stuck ureter needed surgically removed . ct scan found . looked ct results curious big stones , saw also found mild dependent atelectasis inferior chest never told , blows mind , breathing issues past couple years gotten better . first time something diagnosed via imaging doctors failed inform . issues right upper quadrant pain 10 years , process diagnosing crohn , multiple imaging tests years show fatty liver , none doctors told , even gi . took looking imaging reports find , livid . doctors ?",Skylarsthelimit,ChronicIllness,166,0.91,61,2025-08-20 23:55:05,https://www.reddit.com/r/ChronicIllness/comments/1mw0lcy/why_do_doctors_not_tell_you_things/,0,97,566,0
1n9jfta,Organized our fridge today 😍,,organized fridge today,RphBugz,Pharmacy,1135,0.99,104,2025-09-05 18:45:26,https://i.redd.it/116j3qk2dfnf1.jpeg,0,3,22,0
1mv6dot,Fellow pharmacists! Help me name this good boy,,fellow pharmacists ! help name good boy looking something fit antidepressant theme . reference sister zoey zoloft . tia !,dooduoo,Pharmacy,932,0.98,230,2025-08-20 01:41:26,https://i.redd.it/k1ba4irr34kf1.jpeg,0,20,121,0
1mxlddd,A worker from the mcdonalds across the street just brought us some free goodies to say they appreciate us  so thoughtful,,worker mcdonalds across street brought us free goodies say appreciate us thoughtful,tfartieschelly6,Pharmacy,668,0.98,24,2025-08-22 19:05:38,https://i.imgur.com/zscbQt2.png,0,12,83,-1
1mw2h11,Spot the difference.,,"spot difference . someone tape manufacturer bottle labeled , rts entire manufacturer label came . think pretty good job , techs even tell difference !",FaeKae13,Pharmacy,379,0.96,26,2025-08-21 01:37:08,https://i.redd.it/kfwfauxx7bkf1.jpeg,0,25,150,0
1mwgzgh,"As an IV room tech, this is some wild technique for drawing up lidocaine on Grey’s Anatomy…",,"iv room tech , wild technique drawing lidocaine grey anatomy",WashedUpPromQueen,Pharmacy,305,0.99,51,2025-08-21 13:10:27,https://i.redd.it/s28p2ovmnekf1.jpeg,0,10,60,0
1mwwrrw,A nice gift we got from one of the other departments at the hospital,,nice gift got one departments hospital,ratliker62,Pharmacy,293,1.0,24,2025-08-22 00:18:39,https://i.redd.it/nv280pmuyhkf1.jpeg,0,6,38,0
1mw2ksc,Found my roommate dead yesterday morning.,,"found roommate dead yesterday morning . sure right place post . left court yesterday morning 9:30 , roommate sitting chair kitchen . context , person late 60 drank daily basis . rent room . waiting awhile finally talked attorney . finally got home hung neighbors bit heading inside . first got inside went straight room paying attention around . took dog outside got back inside finally saw poor roommate floor . shook called name got response saw face purple . finally called 911 , much shock kind still . never expected come back home dead body one make call like . something go therapy see someone ? roughly 13 hours since started get sight roommate head . really true someone gone look .",bluunted420,MentalHealth,884,0.99,114,2025-08-21 01:43:15,https://www.reddit.com/r/mentalhealth/comments/1mw2ksc/found_my_roommate_dead_yesterday_morning/,0,123,691,0
1mwpbn1,My 6 year old “would be happier if she was dead”,,"6 year old would happier dead sure post would make sense . daughter almost seven last night told would happier dead . said things like hate family , want dead want d1e . asked questions felt way told much loved valued . death final something people come back . also reached pediatrician provide community behavioral health resources contacted schools social worker . recent things happened see stressors : pittie passed due cancer months ago 4 since puppy baby february great grandmother passed month ago home baby sis summer lots jealousy came summer also important note dad separated younger around 3 months . sees weekends . struggling best support . sad feeling intense emotions able process .",WesternPassenger3182,MentalHealth,363,0.97,104,2025-08-21 18:29:10,https://www.reddit.com/r/mentalhealth/comments/1mwpbn1/my_6_year_old_would_be_happier_if_she_was_dead/,0,116,697,0
1mvzo13,Rich people are killing us and there is nothing we can do,,"rich people killing us nothing guys know im talking . world people dying cant change rich care making money keeping people alive . hate world , hate become , hate let happen , hate ignorant people , hate , makes sad , always poor surviving paychecks paychecks , cant afford school , cant afford house , cant afford live , hate fucking much . ? absolutely fucking nothing . rant internet hope things change , gone protests , ive seen people get exposed horrible behaviour , ive done everything ive told make world living shitty little room crying fucked world fuck . nothing . people ? nothing fund wars , ayyeye , billionairs dictators , suffer consequences actions didnt fucking make . suffer things fucking say ? live world forced world care , care friends suffer like , care friends family passed away world didnt care . want . cant . go ill add statistics people love suffer . wan na like heartless rich people , unlike fucking care .",Medical_Lead_289,MentalHealth,222,0.95,67,2025-08-20 23:08:02,https://www.reddit.com/r/mentalhealth/comments/1mvzo13/rich_people_are_killing_us_and_there_is_nothing/,0,170,938,0
1nixoqu,"Was repeatedly raped throughout my childhood, currently feeling miserable and cocaine addict. Need to talk. Help.",,"repeatedly raped throughout childhood , currently feeling miserable cocaine addict . need talk . help . help .",montecristo1111,MentalHealth,197,0.99,80,2025-09-16 19:45:59,https://www.reddit.com/r/mentalhealth/comments/1nixoqu/was_repeatedly_raped_throughout_my_childhood/,0,18,110,0
1ncy29r,"People who say killing yourself is selfish, how?",,"people say killing selfish , ? wondering",Firm-Ad-2792,MentalHealth,189,0.93,144,2025-09-09 19:05:54,https://www.reddit.com/r/mentalhealth/comments/1ncy29r/people_who_say_killing_yourself_is_selfish_how/,0,7,40,0
1nj723o,"My uncle had this recurring infection for some time now in the foot, doctors can’t properly explain what this is, may I know if this gangrene? Its smelly, scaly, and oozes out pus.",,"uncle recurring infection time foot , doctors properly explain , may know gangrene ? smelly , scaly , oozes pus .",akuani,medical,93,0.97,34,2025-09-17 03:58:40,https://i.redd.it/fcijj1sslopf1.jpeg,0,21,113,0
1mvgdhu,Currently experiencing the most painful thing in my life. Left foot is hurting extremely,,"currently experiencing painful thing life . left foot hurting extremely hello everyone . currently cuba experiencing massive pain left foot . tried go hospitals last night turned away none electricity anything . try going bit today wanted see anyone advice . 4 5 days woke slight pain left foot around big toe area . pain bad continued days normal . included decent amount walking , maybe 10 15k day . however yesterday woke pain 100x worse . hurts maybe like 5 10 resting immediately becomes 10 10 try move take step . unfortunately many resources available country go pharmacy buy medication . advil brought taking since yesterday . fly back canada saturday probably immediately go er get better . hoping something make bit better flight .",spacefish420,medical,58,0.97,25,2025-08-20 10:29:09,https://www.reddit.com/gallery/1mvgdhu,0,126,741,0
1nbq1xy,"How to advocate for myself in the ER/with new doctors when I have an ""annoying"" illness?",,"advocate e new doctors annoying illness ? : get medical professionals outside normal team take mast cell disorder seriously , especially er ? mid 2024 , diagnosed mcas . rolled eyes , problem . never heard told , apparently popular tiktok disease . bonus , fat , white , middle aged , comorbidities . know exactly medical professionals think even open mouth . trust established doctors take seriously , also hand bullshit disgnoses . problem see new doctors , hypothetically go er , expected know full history . condition worsened severely surgery december , despite 8 months treatment , disabled . experience left frankly terrified future hospital stays dismissal could mean lasting harm . yet know full extent triggers . chart lists maybe five allergies , reactions always dramatic . hives rash may seem minor , , every reaction layers onto next trigger weeks long systemic flares , worse . die chlorhexidine , resulting two week rash could cascade symptoms never fully recover . . life ruined series minor reactions . know things could handled differently ; want staff careful take condition seriously . already new doctors shrug , risk er setting start running fluids standard procedures even get talk someone 2 minutes . published mcas emergency protocol medication recommendations imagine ridiculous sounds patient ask job based bit paper brought . way think protect , worry would make things worse . make medical staff understand looks routine alter course life ? need conservative take chart seriously , know advocate without setting alarm bells problem patient .",Uzura_2,medical,50,0.86,21,2025-09-08 10:59:50,https://www.reddit.com/r/medical/comments/1nbq1xy/how_to_advocate_for_myself_in_the_erwith_new/,0,256,1571,0
