id,title,text,cleaned_text,author,subreddit,score,upvote_ratio,num_comments,created_utc,url,is_self,word_count,char_count,cluster_id
1n7kkvv,I need some help with this,,"need help ok . long story shorter , minor incident pulled took nap car someone called police . ambulance showed cops . refused treatment said check blood pressure . told didnt want cops yelled . took pressure signed light eyes . left . 3 weeks later get bill ambulance 1100 shining light eyes taking pressures . like . medicaid happened . today last day medicaid . medicaid pay part bill ? . happens dont pay ? barely make 1100 whole month ! im scared right someone tell something add im pennsylvania",legendarysupermom,Medicaid,9,0.8,7,2025-09-03 13:06:09,https://www.reddit.com/r/Medicaid/comments/1n7kkvv/i_need_some_help_with_this/,0,91,500,0
1n4d2gp,Why insurance so expensive man…,,"insurance expensive man insane wife , two toddlers self employee insurance costs 1000 month . get insurance goes completely shit max pocket . pay 30 visit reach minimum ever thanks god reach . wild . looking make year qualify sort health market place kind . ; normal ? swear biggest scam go er billing insane . toddler busted lip needed stitches went urgent care tell without anything done go er . billed insurance 700 responsible 200 er visit expect usually higher . bill like 10k responsible 1,700 sear united state healthcare biggest scam world . became ok pay prices even good insurcane cigna florida supposedly one best companies . suggestion new norm .",Several_Stable_3991,healthinsurance,174,0.9,260,2025-08-30 17:26:50,https://www.reddit.com/r/HealthInsurance/comments/1n4d2gp/why_insurance_so_expensive_man/,0,113,658,0
1n1vwy0,No longer eligible for medicaid,,"longer eligible medicaid 26m illinois medicaid past 3 4ish years . redetermination period completed aug 2025. submitted redetermination letter mail last month called automated number today check status tell benefits ended exceeding income . always done medicaid application redetermination including parents household income retirement , neither work anymore . prior year , father income retirement . however , last year mother also started getting retirement benefits apparently pushed household income past medicaid income cap 3 people . longer eligible medicaid . fucking whole time redetermination including household ? file taxes total income unemployment benefits still low enough claimed dependent anything . moving forward ? start entirely new application website information none parents ? screwed buy health insurance marketplace ? : thanks replies help ; reapply without information . also , guess really specify financial situation original post like thought . left job couple months prior whole thing . moved back parents shortly living modestly though savings . income moment .",petermarq,Medicaid,28,0.88,29,2025-08-27 18:57:16,https://www.reddit.com/r/Medicaid/comments/1n1vwy0/no_longer_eligible_for_medicaid/,0,160,1091,0
1nhxc24,Elderly Care,,elderly care hello grandma recently become ill needing long term nursing care came issue bought 3 life insurance policy threshold 2000 medicaid top found report policys medicaid see need also enrolled medicaid since 2009 renewed ever automatic renewal never crossed mind report . wanted make sure sort money passed causing assistance long term nursing care sure medicaid obviously see fraud make uneligible . state texas .,AlternativeTop7660,Medicaid,16,0.94,15,2025-09-15 16:34:21,https://www.reddit.com/r/Medicaid/comments/1nhxc24/elderly_care/,0,66,422,0
1n1vfiq,GA - Georgia mom here – my son is trapped on repeat psych holds because Medicaid refuses EPSDT-required in-home care,,"ga georgia mom son trapped repeat psych holds medicaid refuses epsdt required home care mom georgia , middle hardest fight life . 14 year old son tj severe autism . nonverbal , toilet trained , destructive , self injurious , assaults daily . right sitting er back back 1013 psychiatric holds facility take honestly , want another facility anyway . one recently five months horrible nightmare restraints , forced procedures , overmedication . reality : choices 1. sedation er , 2. another facility likely harmed , 3. bringing home living hell aggression crisis manage safely alone . kicker : federal law epsdt says medicaid must provide medically necessary services kids 21 , even state plan . means home supports like nursing , behavioral staff , therapies , respite , crisis help . even built detailed home treatment plan tj around school schedule . georgia medicaid keeps saying services exist . meanwhile , families like mine shoved cycle : crisis home er sedation psych hold facility back home support repeat . posting want people know story . systemic failure . agencies meant protect kids profiting instead . families destroyed , taxpayer money wasted , children left suffer . anyone fought epsdt battle medicaid ? actually gotten home services approved ? worked ? desperate advice also trying shine light broken system . thanks reading .",Due_You2581,Medicaid,94,0.93,17,2025-08-27 18:36:50,https://www.reddit.com/r/Medicaid/comments/1n1vfiq/ga_georgia_mom_here_my_son_is_trapped_on_repeat/,0,223,1344,0
1naa0qs,Mold/Mildew smell coming from husband and it's grossing me out. Help!,,"mold mildew smell coming husband grossing . help ! title says , last year 34f husband 45m emitting horrible mildew smell . first , could tell towels , stripped towels , clean , replaced ones clean brand new ones . towels immediately started smelling better , noticed smell.on husband . worse near neck , hairline area , private area . worse , new towels got gotten mildew smell , usually used . throw away . feel like might actually originating towels kids use ones days , continue smell fine . clothes carry smell , point refuse wash anybody else clothes . pillows sofa sits carry smell , lesser extent ; bathroom , uses , absolutely reeks . first , tried leaving bathroom door open airing , seem help , leave closed want vomit every time walk door . really starting affect intimate want , want embarrass either . note , super smeller seem one smell . know imaging something medically wrong . active garden yard everyday extremely hairy . know anymore.but fear getting close : anyone experience , advice greatly appreciated .",Inquisitor23397,medical,66,0.97,55,2025-09-06 16:32:40,https://www.reddit.com/r/medical/comments/1naa0qs/moldmildew_smell_coming_from_husband_and_its/,0,182,1026,0
1mxlr3x,Is getting Medicaid in Texas imposible?,,"getting medicaid texas imposible ? 37 year old male texas . complications spinal surgery june 2024 left able walk wheelchair bound . know single childless adults receive medicaid texas , applying elderly disabled version medicaid since october 2024. everytime get denied . tell get medicaid medicare cost savings . recently applied seems like ssdi might get approved next month year review process . tried everything think get approved elderly disabled medicaid , run brick wall everytime . even asked someone come living prove disabled . person came gave medicaid application told apply . . anyone advice . texas hhs gives runaround .",justplaininteresting,Medicaid,56,0.94,86,2025-08-22 19:21:47,https://www.reddit.com/r/Medicaid/comments/1mxlr3x/is_getting_medicaid_in_texas_imposible/,0,102,635,0
1n7w72m,Am I (F21) in the wrong if I report nurses after I heard them talking about my recurring UTI?,,"f21 wrong report nurses heard talking recurring uti ? 21 year old female , sexually active boyfriend uti . issue , get uti lot . sucks , extremely painful , feel ashamed even mention . first started sex boyfriend year ago virgin well got uti . freaking immediately went doctors painful got put antibiotics . cue next month , got , three months got . point trying everything solve recurring issue . wiped thoroughly , front back . peed intercourse . took supplements cranberry , mannose , name , drank much water felt bloated , even bought body wash designed lower region . got point asked put preventative antibiotics , started taking 250 mg cephalexin post intercourse . best part , worked . get uti year , felt amazing . downside , realized moment slipped ran medication get uti right . brings . slipped bring medication went boyfriend house . realized late pain two days . went doctors immediately ended seeing someone else usual usual doctor booked . explained needed put cephalexin cure uti antibiotic worked , tried lot past . gave dull look told t. going argue someone field also urine culture , assumed . told going put something else called cefdenir said similar cephalexin . told would prefer least put cephalexin first prescribed antibiotics work go classes work pain . said , left get prescription , . left door slightly open , room , facing little hub nurses doctor desks . started hearing say uti , started listening realized talking . frequent uti 4 uti one year . horrible would stop sex . almost tears one girl mentioned something wrong many . know , hearing loud make better . got script finally , went home , cried , told parents . mom dad said report , going call location . reportable situation ? necessarily bashing saying super hurtful things . : wanted add took cefdenir two days , pain whole time symptoms barely lessened . emergency telemedicine usual doctor .",No-Chemist8230,medical,150,0.86,64,2025-09-03 20:47:52,https://www.reddit.com/r/medical/comments/1n7w72m/am_i_f21_in_the_wrong_if_i_report_nurses_after_i/,0,332,1886,0
1myj5eb,Vent,,"vent wonder medicare hurting money ? given quantum wheelchair 16 hours . also medicare g supplement . rather getting wheelchair medicare willing use chair . new cost 25,000 . problem find anyone help size . asked pt . even contacted several dme dealers offered pay help . found support . unless purchase dealer . assist even willing pay . looked ebay dozens chairs sale less 5,000. ? really logical . lot good chairs available reasonable cost help utilize . better way . ideas ? comments ?",MacaronWhich6391,Medicare,16,0.91,13,2025-08-23 21:43:37,https://www.reddit.com/r/medicare/comments/1myj5eb/vent/,0,86,489,0
1njs8az,Medicaid denied (Florida),,medicaid denied florida mother severe stroke leaving bed bound . insurance employer terminated able go back work . started receiving ssdi 1400 . medicaid denied claim due exceeding limit medicaid . sure since income receiving 1400 monthly ssdi . advice ?,Asleep_Combination72,Medicaid,23,0.93,28,2025-09-17 19:07:17,https://www.reddit.com/r/Medicaid/comments/1njs8az/medicaid_denied_florida/,0,41,254,0
1nhjdlo,Preventative exam turned into office visit,,"preventative exam turned office visit went see physician annual physical . informed nurse preventative exam . soon saw doctor , informed wanted preventative exam . ask questions discuss problems concerns exam . doctor asked questions health . advised get thyroid biopsy since one last year benign . declined stating fine . got surprise bill additional 189.79 office visit . doctor never informed exam advising get thyroid biopsy would result additional fees . rights ?",Intelligent-Mud7047,healthinsurance,207,0.92,209,2025-09-15 07:35:50,https://www.reddit.com/r/HealthInsurance/comments/1nhjdlo/preventative_exam_turned_into_office_visit/,0,74,468,0
1n3m092,10F - Neurological Decline,,"10f neurological decline previously healthy 10f excelling school state testing peers actively engaged travel soccer , multiple friend groups , cbt , strong family presence . running soccer tournament day decline . since early 2025 progressive neurologic decline . told fnd . followed booklet , therapies pt , ot , psychology , tutoring , activity based rehab . early could still swim walk , activity pushed , worse became . wheelchair dependent . letters psychologist therapist supporting authentic symptoms traumatized dismissed . objective findings optic neuritis bilateral optic nerve sheath enhancement brain mri : encephalomalacia old hemorrhage , multiple microhemorrhages . spine mri : sacral stir signal , paraspinal psoas edema , bladder distention . bladder scan : urinary retention pvr 220 ml . urge bladde ana positive 1:80 1:320 ; dsdna negative ; complements normal . steroid response : improved dramatically iv steroids , relapsed wore . documented provider continues ignored . green color blindness , new . double , blurry , black vision consistent throughout exception steroids . wheelchair dependent . absent bladde urge . severe dizziness , diplopia , tremors jerks , chest pain , cognitive emotional changes . continued decline despite following every fnd recommendation . elevated bp hr multiple times hypotension . pain previous injury sites continues participate able . report asked , otherwise masks symptoms able . daughter continues decline . get real help ? readily aware documentation bias chart , state appointments.it truly matter . half year since daughter baseline , get help ? wrong ? something say ?",That_One9597,AskDocs,350,0.98,73,2025-08-29 19:02:28,https://www.reddit.com/r/AskDocs/comments/1n3m092/10f_neurological_decline/,0,256,1633,0
1ncz6jg,"""Not medically necessary"" my arse",,"medically necessary arse tmi , trigger warning . began rectal bleeding years ago , began noticing hemorrhoid . would bleed , bleed , hemorrhoid never retracted . went doctor week told eat fiber . pretty healthy individual got plenty fiber . make long story short , dealing awhile , went pcp referred colorectal surgeon looked butt diagnosed hemorrhoid anal sentinel tag unhealed fissure . gave cream , used , tag go away , said likely go away . got second opinion women health surgeon told removing tag size small grape , would covered insurance cosmetic . issue , tag quite painful . hurts bowel movement , hurts pass gas . hurts sit . looking mirror glove tag leaking light pink fluid . frustrated cosmetic , hurts exercise . reached pcp today maternity leave mid december . know else prove insurance causes pain cosmetic ? mean yes , part cosmetic . definitely causes lot discomfort . ready remove piece floss , vasculature anal region , would like end infection .",RipeAvocadoLapdance,healthinsurance,76,0.88,57,2025-09-09 19:55:12,https://www.reddit.com/r/HealthInsurance/comments/1ncz6jg/not_medically_necessary_my_arse/,0,169,967,0
1nd266p,MI Is it even worth trying to get Medicaid?,,"mi even worth trying get medicaid ? family income trajectory 180 , going comfortable 150k year zero . lost job due lengthy recovery 2nd spinal cord surgery ended failing , wife notified laid october due economy . third spine surgery completed week ago , top concern maintaining health insurance specifically . currently working ssdi process , need proactive plan . debating whether try medicaid bridge insurance gap . non vehicle assets trust eight years , vehicle situation somewhat complex . car significant equity title loan , wife slightly underwater loan , third truck outright non running worth 4k running current condition maybe 2k . alternative use severance , includes six months subsidized health insurance switching cobra needed . thoughts ? get started wait know months line . ultimate goal get approved ssdi use wife work insurance medicare couple years qualify . : completely forgot wife 100k 401k 0 cashing trying live past year . sure hurt .",Alarmed-Influence329,Medicaid,23,0.88,37,2025-09-09 22:15:20,https://www.reddit.com/r/Medicaid/comments/1nd266p/mi_is_it_even_worth_trying_to_get_medicaid/,0,157,957,0
1n3exod,The DEAD Pharmacist,,"dead pharmacist practicing since january 2019 , honestly , every single day career nothing misery . first , worked retail cvs three years , jumped hospital , home infusion , oncology outpatient , long term care , independent pharmacy . jobs , found home infusion somewhat tolerable , stayed . company work shutting end september , laying everyone . completely lost motivation enthusiasm years bullying emotional abuse pharmacist . called stupid twice . evaluations nothing short bullying . , told worst pharmacist building . times , told socially awkward introvert . even tho thats reserved avoid problems talking like happened past . even forced take personality tests , placed pips , threatened termination eventually resign voluntarily . truth , bad pharmacist . yes could problem worked read books tried listen pointers told one helped never met expectations liking . never harmed patient , never appreciated thanked work . instead , constantly criticized devalued . flaws absolutely make mistakes like humans sure ! focus shift flaws killed ! , feel like dead pharmacist . want continue career . amount emotional abuse got practicing pharmacist didnt get pumping gas back day nj . hate passion . hate every second spend work . lost motivation , enthusiasm , every drop passion pharmacy . , looking real purpose life pharmacy . peace .",OkExamination5171,Pharmacy,220,0.91,149,2025-08-29 14:15:41,https://www.reddit.com/r/pharmacy/comments/1n3exod/the_dead_pharmacist/,0,219,1339,0
1nfy03t,I think it’s my fault my husband died,,"think fault husband died last days absolute hell stop wondering went wrong . still waiting autopsy results . wednesday husband 35 6 6 200lbs told feeling know describe , seemed irritable exhausted talking morning . hour office 9 texted vomited going come home rest day try get sleep . left work get kids school 3:00 got home poked head room still sleeping . told home , asked needed anything , grunted assumed decided get kids house could rest . 6 kids age 14 7 3 previous marriage 3 mine get really loud rambunctious sometimes . went trampoline park place took kids get pizza dinner . got home 7 went check husband noticed breathing really weird . get wake called 911. phone dispatch stopped breathing . find pulse walked cpr know wrong . ems arrived took tried shocking feeling sake , thought would work waiting autopsy , keep wondering fault . taken kids instead asked go urgent care could stopped . bad cpr would made difference ? dinner home instead stopping pizza could noticed weird breathing earlier called 911 time ?",[deleted],AskDocs,1754,0.98,211,2025-09-13 09:50:25,https://www.reddit.com/r/AskDocs/comments/1nfy03t/i_think_its_my_fault_my_husband_died/,0,180,1025,0
1n9oegj,How did CVS and Walgreens manage to brainwash employees into believing profitability is an employee's concern?,,"cvs walgreens manage brainwash employees believing profitability employee concern ? came across post cvs walgreens emailing store employees type email , mention september make profits . also letting employees know vaccine goal . first , franchise store ? employees need know much profit made ? guys work company . corporate trouble selling , thats issue . maybe advertise better television ads billboards . maybe house lap dancer offer lap dances getting vaccine . idk . corporate figure . corporate folks dls get paid big bucks . store employee pay range . second , seems like email memo need send customers . employees need know whatever goal ? corporate customers . power employee goal , injecting vaccines selves ? requiring employees ask every customer totally fine enforceable issue corporate auditing employees stores . ends . employee ever need know anything goal . used work cvs laughed , everyone district knew , pharmacists remained spineless ate . obviously strength numbers let go . every pharmacist pushed back laughed emails would real change . actually feel cringe even send emails like cringy email . going feel sympathy pharmacists keep staying late million vaccines tech called take complete missing tech work . really dig grave work conditions retail . even advanced one step disperse information techs well . yea going keep techs long . revolving door pharmacies .",Same-Fox9304,Pharmacy,172,0.94,114,2025-09-05 22:43:21,https://i.redd.it/o1in84rijgnf1.jpeg,0,224,1385,0
1nau64o,Do you think your chronic illness(es) make it harder to tell when you have other temporary medical issues?,,"think chronic illness es make harder tell temporary medical issues ? hi , several chronic illnesses including hashimoto disease , gerd , dysautonomia , asthma , chronic sinusitis . along journey meet medical concerns notice becomes easier brush things must something one chronic illnesses . example , recently several instances blood urine uti negative brushed maybe dysautonomia salt intake causing urinary strain irritation . 2 weeks later , passed appears kidney stone likely caused several medications increase risk occurrence . seeing brown specks urine experiencing lot pain started questioning hey maybe actually kidneys . anyone else experience feel easier brush issues answer obvious chronic illness es ?",Emotional_Lie_8283,ChronicIllness,125,0.98,46,2025-09-07 10:09:43,https://www.reddit.com/r/ChronicIllness/comments/1nau64o/do_you_think_your_chronic_illnesses_make_it/,0,107,713,0
1nj2sh7,Plan G,,"plan g research , planning get plan g. reside mercer county . scheduled meetings medicare consultants county medicare officials . assuming afford monthly premium , company choose plan g ensure best service ? eligible medicare december 2025. note : mercer county new jersey thank information . additional question : someone decides say get plan g company . make difference signs directly without help agents . using agent benefits ?",Lotus601216,Medicare,16,0.95,33,2025-09-16 23:47:34,https://www.reddit.com/r/medicare/comments/1nj2sh7/plan_g/,0,69,431,0
1myh2n1,So I apparently have to make my post NSFW and TW to ask for help since I'm dying from chronic pancreatitis.,,"apparently make post nsfw tw ask help since dying chronic pancreatitis . said previous post dying chronic pancreatitis plus bunch painful conditions . life sucks sick time going er time . refuse anything . drink , smoke , use drugs , pancreatitis caused birth defect . need pancreas removed one insurance company let go state . tried apply palliative care help people cancer . pain management treat anklosing spondylitis . go er tell go pain doctor . doctors dropped one willing help . supposed live like ? get help dying send home . nobody cares medical community .",[deleted],ChronicIllness,126,0.91,30,2025-08-23 20:00:16,https://www.reddit.com/r/ChronicIllness/comments/1myh2n1/so_i_apparently_have_to_make_my_post_nsfw_and_tw/,0,98,566,0
1nd36gc,"I’m 33 weeks pregnant with twins and something feels wrong, I feel vague dread",,"33 weeks pregnant twins something feels wrong , feel vague dread 19f 5 6 130lbs , 33 weeks pregnant twins , working recovering anorexia hi doctors . group really helpful beginning pregnancy , thought would come question . morning started feel nauseous , bad headache . drinking water trying rest eating goldfish crackers , really helping . thrown times , tried ginger tea work started trying sip gatorade . really concerning babies moving differently . know moving concerning movements feel faster ? little frantic ? tell imagining feels like movements almost panicked feeling doom . know hormones .is worth going ? night feeling nervous fall asleep . want seen anxious first time mom , something feels . feel stupid calling saying think moving much . raise red flags ? today feeling overall fine considering 33 weeks twins .",No-Focus-5369,AskDocs,1079,0.97,216,2025-09-09 23:04:19,https://www.reddit.com/r/AskDocs/comments/1nd36gc/im_33_weeks_pregnant_with_twins_and_something/,0,138,825,0
1n7383g,I'm a type 1 diabetic. Let's say society collapses and I can't get insulin anymore. Is it possible to survive with extremely careful dieting and exercise?,,"type 1 diabetic . let say society collapses get insulin anymore . possible survive extremely careful dieting exercise ? know need insulin ultilize carbs energy , without body breaks fat alarming rate , releases keytones , acids poison blood cause ketosis , turning blood acid . dka acid blood feels like sounds . exercise reduce blood sugar without taking extra insulin always long acting board . possible somehow form regiment careful diet exercise allow survive apocalyptic scenario without external insulin ? feel lows highs , worst highs 300 , gon na thirsty peeing lot burning weakness chest would still leave like 60 250 without able feel damage done even survive . could keep keytones minimum , like burn enough fat survive also somehow stay dka ? doctor excuse lack understanding . body capable tolerating extremes would kill diabetics , walking around meter read 20 lost insurance right needed fill scripts lasted 11 days rationing short acting . worst case hospital ever even heard told family hopeful . one doctor asked permission use case write paper bad . lost dozens pounds pissed like 50 gallons across less week came coma . 11 days still novolog . way , assuming everything perfectly , could last longer ? impossible ?",pichael289,AskDocs,362,0.96,127,2025-09-02 22:38:25,https://www.reddit.com/r/AskDocs/comments/1n7383g/im_a_type_1_diabetic_lets_say_society_collapses/,0,207,1234,0
1n31xzk,I cannot make friends because everyone wants to fuck me,,"make friends everyone wants fuck title exactly correct . f19 bisexual matter gender friends never matter wanted friend connect someone . say mostly men referring . starts friends always intentions trying get pants . feel flattered ? sure whatever also horrible feeling . already lonely person begging friends people sexual intentions wanted friends feel upset like good . really bad sex purpose ? never entertain behaviour shut immediately like leading guys , clear boundaries . basically begged friends maybe week ago well guess dms like . already suicidal person looking distraction behaviour makes feel worse . get many creeps mental health subreddit , everyone needs sort help",iammentallynotoklol,MentalHealth,605,0.89,292,2025-08-29 04:37:09,https://www.reddit.com/r/mentalhealth/comments/1n31xzk/i_cannot_make_friends_because_everyone_wants_to/,0,107,680,0
